product_name,store_name,rating,comment_count,price,sold,link
Cho Samsung 7 siêu GPS NFC La bàn đồng hồ thông minh thể thao ngoài trời người đàn ông AMOLED BT cuộc gọi IP68 Galaxy 6 nâng cấp Smartwatch smartwatches,Không tìm thấy cửa hàng,0,Không có đánh giá,"₫545,012",N/A,https://www.lazada.vn/products/cho-samsung-7-sieu-gps-nfc-la-ban-dong-ho-thong-minh-the-thao-ngoai-troi-nguoi-dan-ong-amoled-bt-cuoc-goi-ip68-galaxy-6-nang-cap-smartwatch-smartwatches-i2894602776.html
Đồng Hồ Thông Minh Samsung Galaxy Watch 7 Ultra AMOLED NFC GPS La Bàn IP68 Cuộc Gọi Bluetooth Chống Nước Thể Thao Dành Cho Nam Nữ 2024,Không tìm thấy cửa hàng,0,Không có đánh giá,"₫640,000",15 sold,https://www.lazada.vn/products/dong-ho-thong-minh-samsung-galaxy-watch-7-ultra-amoled-nfc-gps-la-ban-ip68-cuoc-goi-bluetooth-chong-nuoc-the-thao-danh-cho-nam-nu-2024-i2760246089.html
Đồng Hồ Thông Minh Cổ Điển Samsung Galaxy Watch Dành Cho Nam Nữ Màn Hình AMOLED HD GPS Theo Dõi NFC Mặt Số Tùy Chỉnh Gọi Thoại Đồng Hồ Thể Thao,Không tìm thấy cửa hàng,0,Không có đánh giá,"₫524,800",N/A,https://www.lazada.vn/products/dong-ho-thong-minh-co-dien-samsung-galaxy-watch-danh-cho-nam-nu-man-hinh-amoled-hd-gps-theo-doi-nfc-mat-so-tuy-chinh-goi-thoai-dong-ho-the-thao-i2873786208.html
Đồng Hồ Thông Minh Samsung Galaxy 2024 Cuộc Gọi Bluetooth Mới Đồng Hồ Thông Minh Thể Thao Chống Nước Dành Cho Nam Giới Phụ Nữ Có Huyết Áp Theo Dõi Oxy Trong Máu,GlobalLifestyle,0,Không có đánh giá,"₫142,100",42 sold,https://www.lazada.vn/products/dong-ho-thong-minh-samsung-galaxy-2024-cuoc-goi-bluetooth-moi-dong-ho-thong-minh-the-thao-chong-nuoc-danh-cho-nam-gioi-phu-nu-co-huyet-ap-theo-doi-oxy-trong-mau-i2922401356.html
Đồng hồ tròn thông minh Samsung Galaxy Watch Ultra 2 dành cho nam Theo dõi nhịp tim & huyết áp Dây thép không gỉ,Không tìm thấy cửa hàng,0,Không có đánh giá,"₫566,000",16 sold,https://www.lazada.vn/products/dong-ho-tron-thong-minh-samsung-galaxy-watch-ultra-2-danh-cho-nam-theo-doi-nhip-tim-huyet-ap-day-thep-khong-gi-i2751049205.html
"Đồng hồ thông minh Samsung Galaxy Watch Ultra Nfc Gps dành cho nam Màn hình AMOLED 1.43"" với nhịp tim & theo dõi huyết áp Màn hình cảm ứng Bluetooth 5.3 Ip68 Chống nước Không theo dõi Gps",Không tìm thấy cửa hàng,0,Không có đánh giá,"₫710,000",N/A,https://www.lazada.vn/products/dong-ho-thong-minh-samsung-galaxy-watch-ultra-nfc-gps-danh-cho-nam-man-hinh-amoled-143-voi-nhip-tim-theo-doi-huyet-ap-man-hinh-cam-ung-bluetooth-53-ip68-chong-nuoc-khong-theo-doi-gps-i2777316595.html
Samsung Galaxy Watch 7 2024 Trình theo dõi Gps tròn thông minh với khả năng theo dõi nhịp tim và huyết áp Màn hình HD AMOLED 360 * 360 để theo dõi thể thao và thể hình,Không tìm thấy cửa hàng,0,Không có đánh giá,"₫628,000",N/A,https://www.lazada.vn/products/samsung-galaxy-watch-7-2024-trinh-theo-doi-gps-tron-thong-minh-voi-kha-nang-theo-doi-nhip-tim-va-huyet-ap-man-hinh-hd-amoled-360-360-de-theo-doi-the-thao-va-the-hinh-i2775733388.html
Đồng hồ thông minh Samsung Galaxy Watch 46mm GPS/LTE (esim),Không tìm thấy cửa hàng,0,Không có đánh giá,"₫1,450,000",52 sold,https://www.lazada.vn/products/dong-ho-thong-minh-samsung-galaxy-watch-46mm-gpslte-esim-i635510059.html
Đồng hồ thông minh Samsung Galaxy Watch Ultra Gps Trợ lý giọng nói Theo dõi sức khỏe cuộc gọi với nhịp tim & theo dõi huyết áp Màn hình AMOLED luôn bật Độ phân giải 466x466 Ram 256mb,Global Merch Park,0,Không có đánh giá,"₫624,000",N/A,https://www.lazada.vn/products/dong-ho-thong-minh-samsung-galaxy-watch-ultra-gps-tro-ly-giong-noi-theo-doi-suc-khoe-cuoc-goi-voi-nhip-tim-theo-doi-huyet-ap-man-hinh-amoled-luon-bat-do-phan-giai-466x466-ram-256mb-i2751086892.html
Đồng Hồ Thông Minh Samsung Galaxy Watch 7 Ultra Màn Hình AMOLED La Bàn GPS NFC Thể Thao Ngoài Trời BT Gọi Hỗ Trợ Ngôn Ngữ Hàn Quốc Dành Cho Nam,GlobalSuperBazaar,0,Không có đánh giá,"₫555,000",N/A,https://www.lazada.vn/products/dong-ho-thong-minh-samsung-galaxy-watch-7-ultra-man-hinh-amoled-la-ban-gps-nfc-the-thao-ngoai-troi-bt-goi-ho-tro-ngon-ngu-han-quoc-danh-cho-nam-i2857983697.html
Đồng Hồ Thông Minh Nam Samsung Galaxy Watch 7 Ultra GPS Kiểm Soát NFC Theo Dõi Sức Khỏe Cuộc Gọi BT Màn Hình AMOLED Theo Dõi Sức Khỏe Chống Nước,GlobalLifestyle,0,Không có đánh giá,"₫416,800",27 sold,https://www.lazada.vn/products/dong-ho-thong-minh-nam-samsung-galaxy-watch-7-ultra-gps-kiem-soat-nfc-theo-doi-suc-khoe-cuoc-goi-bt-man-hinh-amoled-theo-doi-suc-khoe-chong-nuoc-i2923283409.html
PENGAGAR Samsung Galaxy Watch 6 Đồng hồ thông minh theo dõi GPS dành cho nam giới có Amoled Luôn hiển thị nhịp tim và huyết áp,Global Merch Park,5.0,25 đánh giá,"₫448,000",134 sold,https://www.lazada.vn/products/pengagar-samsung-galaxy-watch-6-dong-ho-thong-minh-theo-doi-gps-danh-cho-nam-gioi-co-amoled-luon-hien-thi-nhip-tim-va-huyet-ap-i2655170867.html
Đồng hồ thông minh Samsung Galaxy Watch 6 2024 Đồng hồ thông minh tròn AMOLED dành cho nam Đồng hồ thông minh theo dõi Gps có nhịp tim & theo dõi huyết áp Màn hình cảm ứng Bluetooth 5.3,Global Merch Park,5.0,4 đánh giá,"₫157,800",18 sold,https://www.lazada.vn/products/dong-ho-thong-minh-samsung-galaxy-watch-6-2024-dong-ho-thong-minh-tron-amoled-danh-cho-nam-dong-ho-thong-minh-theo-doi-gps-co-nhip-tim-theo-doi-huyet-ap-man-hinh-cam-ung-bluetooth-53-i2730261931.html
Samsung Galaxy Watch 6 Đồng hồ thông minh cổ điển dành cho nam Màn hình Ips tròn AMOLED HD với Gps Nfc Cuộc gọi Bluetooth Theo dõi sức khỏe chống nước,Global Merch Park,0,Không có đánh giá,"₫576,000",N/A,https://www.lazada.vn/products/samsung-galaxy-watch-6-dong-ho-thong-minh-co-dien-danh-cho-nam-man-hinh-ips-tron-amoled-hd-voi-gps-nfc-cuoc-goi-bluetooth-theo-doi-suc-khoe-chong-nuoc-i2750999092.html
Đồng hồ thông minh Samsung 6 Galaxy Bluetooth Quay số cuộc gọi Theo dõi sức khỏe thể thao với nhịp tim & huyết áp cho nam và nữ,Global Merch Park,2.0,2 đánh giá,"₫187,000",22 sold,https://www.lazada.vn/products/dong-ho-thong-minh-samsung-6-galaxy-bluetooth-quay-so-cuoc-goi-theo-doi-suc-khoe-the-thao-voi-nhip-tim-huyet-ap-cho-nam-va-nu-i2775601814.html
Đồng hồ thông minh Samsung Galaxy Watch 6 Classic Đồng hồ thông minh Smartwatch Nam Gps Sports Nfc Cuộc gọi Bluetooth HD Cuộc gọi thoại Amoled Theo dõi sức khỏe với máy đo nhịp tim Máy đo huyết áp Dây thép không gỉ,Global Merch Park,5.0,7 đánh giá,"₫522,000",19 sold,https://www.lazada.vn/products/dong-ho-thong-minh-samsung-galaxy-watch-6-classic-dong-ho-thong-minh-smartwatch-nam-gps-sports-nfc-cuoc-goi-bluetooth-hd-cuoc-goi-thoai-amoled-theo-doi-suc-khoe-voi-may-do-nhip-tim-may-do-huyet-ap-day-thep-khong-gi-i2723622322.html
"[ Hàng Chính Hãng - Bảo Hành 2 Năm] Đồng Hồ Thông Minh Samsung Galaxy Watch 4 Classic, Sạc Không Dây, Thay Hình Nền, Nghe Gọi, Nhân Thông Báo, Pin Khủng, Chống Nước 5ATM, Theo Dõi Sức Khỏe, Bluetooth 5.0, Tương Thích Với Mọi Thiết Bị.",You Little Shop,5.0,26 đánh giá,"₫850,000",37 sold,https://www.lazada.vn/products/hang-chinh-hang-bao-hanh-2-nam-dong-ho-thong-minh-samsung-galaxy-watch-4-classic-sac-khong-day-thay-hinh-nen-nghe-goi-nhan-thong-bao-pin-khung-chong-nuoc-5atm-theo-doi-suc-khoe-bluetooth-50-tuong-thich-voi-moi-thiet-bi-i2088024100.html
2024 Samsung Galaxy Watch 6 Màn hình HD tròn thông minh cổ điển có Gps Cuộc gọi Bluetooth Theo dõi sức khỏe chống nước,Global Merch Park,5.0,1 đánh giá,"₫576,000",N/A,https://www.lazada.vn/products/2024-samsung-galaxy-watch-6-man-hinh-hd-tron-thong-minh-co-dien-co-gps-cuoc-goi-bluetooth-theo-doi-suc-khoe-chong-nuoc-i2775423816.html
Đồng Hồ Thông Minh Samsung Galaxy Watch Ultra Theo Dõi Gps Amoled Luôn Hiển Thị Theo Dõi Nhiệt Độ Cơ Thể Khả Năng Gọi Bluetooth Dành Cho Nam Giới,Global Merch Park,0,1 đánh giá,"₫680,000",10 sold,https://www.lazada.vn/products/dong-ho-thong-minh-samsung-galaxy-watch-ultra-theo-doi-gps-amoled-luon-hien-thi-theo-doi-nhiet-do-co-the-kha-nang-goi-bluetooth-danh-cho-nam-gioi-i2777211499.html
Đồng Hồ Thông Minh GPS Mới Của Samsung Galaxy Watch GT1 Dành Cho Nam Màn Hình AMOLED Nhiệt Độ Cơ Thể Theo Dõi Nhịp Tim BT Talk Tương Thích Với Android iOS,GlobalLifestyle,0,Không có đánh giá,"₫182,000",58 sold,https://www.lazada.vn/products/dong-ho-thong-minh-gps-moi-cua-samsung-galaxy-watch-gt1-danh-cho-nam-man-hinh-amoled-nhiet-do-co-the-theo-doi-nhip-tim-bt-talk-tuong-thich-voi-android-ios-i2905760621.html
ChiBear Samsung Galaxy Watch 6 Đồng hồ thông minh cổ điển dành cho nam Cuộc gọi Bluetooth HD AMOLED NFC GPS Bộ nhớ cuộc gọi bằng giọng nói thể thao Theo dõi sức khỏe,Global Merch Park,0,Không có đánh giá,"₫576,000",N/A,https://www.lazada.vn/products/chibear-samsung-galaxy-watch-6-dong-ho-thong-minh-co-dien-danh-cho-nam-cuoc-goi-bluetooth-hd-amoled-nfc-gps-bo-nho-cuoc-goi-bang-giong-noi-the-thao-theo-doi-suc-khoe-i2723239646.html
Bóng đèn Philips 16 triệu màu Hue WhiteAmbiance (01 bóng),Không tìm thấy cửa hàng,0,Không có đánh giá,"₫940,600",18 sold,https://www.lazada.vn/products/bong-den-philips-16-trieu-mau-hue-whiteambiance-01-bong-i1559737178.html
Bộ LED dây Philips Hue 2m cơ bản,Không tìm thấy cửa hàng,0,Không có đánh giá,"₫1,904,800",10 sold,https://www.lazada.vn/products/bo-led-day-philips-hue-2m-co-ban-i1559625617.html
Bộ kit Philips Hue 16 triệu màu,Không tìm thấy cửa hàng,0,Không có đánh giá,"₫3,840,600",N/A,https://www.lazada.vn/products/bo-kit-philips-hue-16-trieu-mau-i1557481285.html
Bộ kit Philips Hue WhileAmbiance,Đèn Philips chính hãng,0,Không có đánh giá,"₫2,869,800",N/A,https://www.lazada.vn/products/bo-kit-philips-hue-whileambiance-i1559520331.html
Bộ 3 Bóng Đèn Philips Hue White and Color Ambiance Starter Kit E27 Bluetooth | Đã bao gồm Bridge - Hàng Chính Hãng - Bảo hành 2 Năm,Không tìm thấy cửa hàng,0,Không có đánh giá,"₫3,490,000",21 sold,https://www.lazada.vn/products/bo-3-bong-den-philips-hue-white-and-color-ambiance-starter-kit-e27-bluetooth-da-bao-gom-bridge-hang-chinh-hang-bao-hanh-2-nam-i290566048.html
Đèn LED dây Philips Hue Lightstrip Base Pack 2 mét 16 triệu màu và Nguồn - Đồng bộ ánh sáng với PC (cần có Bridge) - Hàng Chính Hãng - Bảo Hành 2 Năm,Smart Homekit,4.9,20 đánh giá,"₫1,850,000",84 sold,https://www.lazada.vn/products/den-led-day-philips-hue-lightstrip-base-pack-2-met-16-trieu-mau-va-nguon-dong-bo-anh-sang-voi-pc-can-co-bridge-hang-chinh-hang-bao-hanh-2-nam-i288594293.html
Philips Hue Bridge full box bảo hành 2 Năm,Không tìm thấy cửa hàng,0,Không có đánh giá,"₫990,000",N/A,https://www.lazada.vn/products/philips-hue-bridge-full-box-bao-hanh-2-nam-i550682391.html
Bóng đèn thông minh Philips Hue White Ambiance Bluetooth 8.5W E27 Ánh sáng vàng - trắng Hàng Chính Hãng - Smart HomeKit,Không tìm thấy cửa hàng,0,Không có đánh giá,"₫770,000",15 sold,https://www.lazada.vn/products/bong-den-thong-minh-philips-hue-white-ambiance-bluetooth-85w-e27-anh-sang-vang-trang-hang-chinh-hang-smart-homekit-i371016057.html
Bóng đèn thông minh Philips Hue White and Color Ambiance E27 Bluetooth 9W 16 triệu màu - Hàng Chính Hãng,Smart Homekit,5.0,2 đánh giá,"₫1,190,000",20 sold,https://www.lazada.vn/products/bong-den-thong-minh-philips-hue-white-and-color-ambiance-e27-bluetooth-9w-16-trieu-mau-hang-chinh-hang-i370246556.html
[Chính Hãng] 2 Đèn LED H1 Ultinon Essential Gen2 Philips UE Gen2 Bảo Hành 01 Năm - PTOUT,Không tìm thấy cửa hàng,0,Không có đánh giá,"₫890,000",N/A,https://www.lazada.vn/products/chinh-hang-2-den-led-h1-ultinon-essential-gen2-philips-ue-gen2-bao-hanh-01-nam-ptout-i2178580940.html
Combo 4 bóng đèn thông minh Philips Hue White and Color Ambiance E27 (tách kit - new 100%) - Bảo hành 2 Năm,Không tìm thấy cửa hàng,0,Không có đánh giá,"₫3,560,000",5 sold,https://www.lazada.vn/products/combo-4-bong-den-thong-minh-philips-hue-white-and-color-ambiance-e27-tach-kit-new-100-bao-hanh-2-nam-i420534034.html
Bộ 2 đèn thông minh Philips Hue Play Bar Double Pack - Đồng bộ ánh sáng với PC TV (cần có Hue Bridge),Smart Homekit,Không có đánh giá,7 đánh giá,"₫3,090,000",31 sold,https://www.lazada.vn/products/bo-2-den-thong-minh-philips-hue-play-bar-double-pack-dong-bo-anh-sang-voi-pc-tv-can-co-hue-bridge-i441486071.html
Đèn thông minh Philips Hue Play Light Bar 16 triệu màu (Trải nghiệm công nghệ ánh sáng hoàn hảo),Đèn Philips chính hãng,0,Không có đánh giá,"₫2,989,987",N/A,https://www.lazada.vn/products/den-thong-minh-philips-hue-play-light-bar-16-trieu-mau-trai-nghiem-cong-nghe-anh-sang-hoan-hao-i2599955156.html
"Bóng đèn thông minh Philips Hue White Ambiance E27 8.5W phiên bản có Bluetooth, ánh sáng trắng sang vàng",VN33VZX8PG,Không có đánh giá,Không có đánh giá,"₫770,000",N/A,https://www.lazada.vn/products/bong-den-thong-minh-philips-hue-white-ambiance-e27-85w-phien-ban-co-bluetooth-anh-sang-trang-sang-vang-i501894406.html
Bóng đèn thông minh Philips Hue White and Color Ambiance E27 9W kết nối Bluetooth và Zigbee | Chính Hãng Phân Phối,Không tìm thấy cửa hàng,0,Không có đánh giá,"₫1,190,000",N/A,https://www.lazada.vn/products/bong-den-thong-minh-philips-hue-white-and-color-ambiance-e27-9w-ket-noi-bluetooth-va-zigbee-chinh-hang-phan-phoi-i495108707.html
Bóng đèn thông minh Philips Hue Filament E27 - Hàng chính hãng,Không tìm thấy cửa hàng,0,Không có đánh giá,"₫1,050,000",N/A,https://www.lazada.vn/products/bong-den-thong-minh-philips-hue-filament-e27-hang-chinh-hang-i2067016860.html
Đèn LED dây mở rộng Philips Hue 1m,Không tìm thấy cửa hàng,0,Không có đánh giá,"₫1,455,400",N/A,https://www.lazada.vn/products/den-led-day-mo-rong-philips-hue-1m-i2274005872.html
Bóng đèn thông minh Philips Hue White A19 - Điều chỉnh độ sáng hỗ trợ Alexa Google Assistant,Không tìm thấy cửa hàng,0,Không có đánh giá,"₫678,000",N/A,https://www.lazada.vn/products/bong-den-thong-minh-philips-hue-white-a19-dieu-chinh-do-sang-ho-tro-alexa-google-assistant-i2152101963.html
Bộ ba đèn thông minh Philips Hue White and Color Ambiance - Starter Kit 3 bóng E27 và Bridge,Không tìm thấy cửa hàng,0,Không có đánh giá,"₫3,800,000",N/A,https://www.lazada.vn/products/bo-ba-den-thong-minh-philips-hue-white-and-color-ambiance-starter-kit-3-bong-e27-va-bridge-i1746728122.html
Bộ đèn thông minh Philips Hue White Ambiance 8.5W,Không tìm thấy cửa hàng,0,Không có đánh giá,"₫790,000",N/A,https://www.lazada.vn/products/bo-den-thong-minh-philips-hue-white-ambiance-85w-i1564876266.html
Philips Hue Brigde không hộp - mới 100% bảo hành 2 năm- Hàng chính hãng,Không tìm thấy cửa hàng,0,Không có đánh giá,"₫1,090,000",N/A,https://www.lazada.vn/products/philips-hue-brigde-khong-hop-moi-100-bao-hanh-2-nam-hang-chinh-hang-i550750430.html
Cảm biến chuyển động Philips Hue Motion Sensor tích hợp cảm biến ánh sáng | Smart HomeKit,Không tìm thấy cửa hàng,0,Không có đánh giá,"₫1,079,000",26 sold,https://www.lazada.vn/products/cam-bien-chuyen-dong-philips-hue-motion-sensor-tich-hop-cam-bien-anh-sang-smart-homekit-i288580446.html
"Philips Hue Play Bar Color Ambiance Double Pack - 2 thanh đèn thông minh 16 triệu màu, đồng bộ với Hue Sync - Hàng Chính Hãng - Bảo hành 2 Năm",Không tìm thấy cửa hàng,0,Không có đánh giá,"₫3,090,000",N/A,https://www.lazada.vn/products/philips-hue-play-bar-color-ambiance-double-pack-2-thanh-den-thong-minh-16-trieu-mau-dong-bo-voi-hue-sync-hang-chinh-hang-bao-hanh-2-nam-i493754101.html
Bóng đèn LED philips HUE fullcolors 12-24V 5W giao thức zigbee kde6055,Khai Dinh,0,Không có đánh giá,"₫88,900",N/A,https://www.lazada.vn/products/bong-den-led-philips-hue-fullcolors-12-24v-5w-giao-thuc-zigbee-kde6055-i2644207241.html
Đèn LED âm trần Philips Hue Downlight Garnea White Ambiance 7W/10.5W - Hàng Chính Hãng - Bảo Hành 2 Năm,Không tìm thấy cửa hàng,0,Không có đánh giá,"₫900,000",17 sold,https://www.lazada.vn/products/den-led-am-tran-philips-hue-downlight-garnea-white-ambiance-7w105w-hang-chinh-hang-bao-hanh-2-nam-i426904214.html
"Philips Hue Bridge V2 tách lẻ Kit - Không hộp, bảo hành 2 năm - Hàng Chính Hãng",Không tìm thấy cửa hàng,0,Không có đánh giá,"₫1,190,000",14 sold,https://www.lazada.vn/products/philips-hue-bridge-v2-tach-le-kit-khong-hop-bao-hanh-2-nam-hang-chinh-hang-i498124556.html
Bộ 3 Đèn Thông Minh (+TẶNG ĐÈN BÀN) Philips HUE White Color Ambiance 9W A60 E27 VN,HALULA,0,Không có đánh giá,"₫4,990,000",N/A,https://www.lazada.vn/products/bo-3-den-thong-minh-tang-den-ban-philips-hue-white-color-ambiance-9w-a60-e27-vn-i1478600572.html
Dây LED 1 mét Philips Hue Lightstrip Base Pack với Bluetooth,HALULA,0,Không có đánh giá,"₫737,000",N/A,https://www.lazada.vn/products/day-led-1-met-philips-hue-lightstrip-base-pack-voi-bluetooth-i1478913092.html
Philips Hue Lightstrip 1 Meter Base Pack with Bluetooth – Flexible LED Strip for Smart Lighting,HALULA EL,0,Không có đánh giá,"₫737,000",N/A,https://www.lazada.vn/products/philips-hue-lightstrip-1-meter-base-pack-with-bluetooth-flexible-led-strip-for-smart-lighting-i2811205557.html
Bộ 2 Bóng Đèn thông minh Philips Hue White Ambiance Starter Kit E27 kèm Bridge và Dimmer - Hàng Chính Hãng - Bảo Hành 2 Năm,VN33VZX8PG,0,Không có đánh giá,"₫1,760,000",N/A,https://www.lazada.vn/products/bo-2-bong-den-thong-minh-philips-hue-white-ambiance-starter-kit-e27-kem-bridge-va-dimmer-hang-chinh-hang-bao-hanh-2-nam-i490976172.html
"Philips Hue Philips 9 wát E27 Hue màu trắng và màu sắc tuyệt vời LED bóng đèn thông minh, Bluetooth & ZigBee tương thích (màu sắc cầu tùy chọn), làm việc với Alexa & Google Assistant",Top Mall - HK,0,Không có đánh giá,"₫1,814,000",N/A,https://www.lazada.vn/products/philips-hue-philips-9-wat-e27-hue-mau-trang-va-mau-sac-tuyet-voi-led-bong-den-thong-minh-bluetooth-zigbee-tuong-thich-mau-sac-cau-tuy-chon-lam-viec-voi-alexa-google-assistant-i2288385119.html
Dây LED Philips Hue Lightstrip Bluetooth bộ cơ bản 2m - đồng bộ ánh sáng theo nhạc và TV (cần có Hue Bridge),VN33VZX8PG,5.0,1 đánh giá,"₫1,840,000",9 sold,https://www.lazada.vn/products/day-led-philips-hue-lightstrip-bluetooth-bo-co-ban-2m-dong-bo-anh-sang-theo-nhac-va-tv-can-co-hue-bridge-i494888870.html
Đèn Philips Hue Play Gradient Lightstrip cho máy tính,Đèn Philips chính hãng,5.0,2 đánh giá,"₫3,633,325",5 sold,https://www.lazada.vn/products/den-philips-hue-play-gradient-lightstrip-cho-may-tinh-i2113053189.html
Bộ 2 Bóng Đèn Thông Minh Philips HUE White Ambiance 8.5W A60 E27 VN,HALULA,0,Không có đánh giá,"₫3,729,000",N/A,https://www.lazada.vn/products/bo-2-bong-den-thong-minh-philips-hue-white-ambiance-85w-a60-e27-vn-i1478659708.html
LED dây thông minh 16 triệu màu Philips Hue Lightstrip Bluetooth bộ mở rộng 1m - đồng bộ ánh sáng theo nhạc và TV,VN33VZX8PG,0,Không có đánh giá,"₫570,000",N/A,https://www.lazada.vn/products/led-day-thong-minh-16-trieu-mau-philips-hue-lightstrip-bluetooth-bo-mo-rong-1m-dong-bo-anh-sang-theo-nhac-va-tv-i495076978.html
Bộ LED dây Philips Hue 2m cơ bản,Trang Trí Nội Thất Đại Lộc,0,Không có đánh giá,"₫4,890,600",N/A,https://www.lazada.vn/products/bo-led-day-philips-hue-2m-co-ban-i2274081615.html
Bộ kit đèn led Philips Hue WhileAmbiance,Trang Trí Nội Thất Đại Lộc,0,Không có đánh giá,"₫7,368,200",N/A,https://www.lazada.vn/products/bo-kit-den-led-philips-hue-whileambiance-i2274046674.html
Bộ 3 Bóng Đèn thông minh 16 triệu màu Philips Hue White and Color Ambiance Starter Kit E27 gồm Bridge,VN33VZX8PG,0,Không có đánh giá,"₫3,510,000",N/A,https://www.lazada.vn/products/bo-3-bong-den-thong-minh-16-trieu-mau-philips-hue-white-and-color-ambiance-starter-kit-e27-gom-bridge-i491110248.html
Đèn LED dây 16 triệu màu Philips Hue Lightstrip Plus 2M – Base KIT,Gió Biển Solutions,0,Không có đánh giá,"₫800,000",N/A,https://www.lazada.vn/products/den-led-day-16-trieu-mau-philips-hue-lightstrip-plus-2m-base-kit-i1564646824.html
Bộ Starter Kit bóng đèn thông minh Philips Hue 16 triệu màu,Business - Insider,Không có đánh giá,Không có đánh giá,"₫4,415,000",N/A,https://www.lazada.vn/products/bo-starter-kit-bong-den-thong-minh-philips-hue-16-trieu-mau-i1877033201.html
Bóng đèn Philips 16 triệu màu Hue WhiteAmbiance (01 bóng),Đèn Philips chính hãng,5.0,1 đánh giá,"₫940,600",18 sold,https://www.lazada.vn/products/bong-den-philips-16-trieu-mau-hue-whiteambiance-01-bong-i1559737178.html
Bộ LED dây Philips Hue 2m cơ bản,Đèn Philips chính hãng,5.0,2 đánh giá,"₫1,904,800",10 sold,https://www.lazada.vn/products/bo-led-day-philips-hue-2m-co-ban-i1559625617.html
Bộ kit Philips Hue 16 triệu màu,Đèn Philips chính hãng,5.0,1 đánh giá,"₫3,840,600",N/A,https://www.lazada.vn/products/bo-kit-philips-hue-16-trieu-mau-i1557481285.html
Bộ kit Philips Hue WhileAmbiance,Đèn Philips chính hãng,0,Không có đánh giá,"₫2,869,800",N/A,https://www.lazada.vn/products/bo-kit-philips-hue-whileambiance-i1559520331.html
Bộ 3 Bóng Đèn Philips Hue White and Color Ambiance Starter Kit E27 Bluetooth | Đã bao gồm Bridge - Hàng Chính Hãng - Bảo hành 2 Năm,Smart Homekit,4.9,8 đánh giá,"₫3,490,000",21 sold,https://www.lazada.vn/products/bo-3-bong-den-philips-hue-white-and-color-ambiance-starter-kit-e27-bluetooth-da-bao-gom-bridge-hang-chinh-hang-bao-hanh-2-nam-i290566048.html
Đèn LED dây Philips Hue Lightstrip Base Pack 2 mét 16 triệu màu và Nguồn - Đồng bộ ánh sáng với PC (cần có Bridge) - Hàng Chính Hãng - Bảo Hành 2 Năm,Smart Homekit,4.9,20 đánh giá,"₫1,850,000",84 sold,https://www.lazada.vn/products/den-led-day-philips-hue-lightstrip-base-pack-2-met-16-trieu-mau-va-nguon-dong-bo-anh-sang-voi-pc-can-co-bridge-hang-chinh-hang-bao-hanh-2-nam-i288594293.html
Philips Hue Bridge full box bảo hành 2 Năm,VN33VZX8PG,5.0,1 đánh giá,"₫990,000",N/A,https://www.lazada.vn/products/philips-hue-bridge-full-box-bao-hanh-2-nam-i550682391.html
Bóng đèn thông minh Philips Hue White Ambiance Bluetooth 8.5W E27 Ánh sáng vàng - trắng Hàng Chính Hãng - Smart HomeKit,Smart Homekit,5.0,3 đánh giá,"₫770,000",15 sold,https://www.lazada.vn/products/bong-den-thong-minh-philips-hue-white-ambiance-bluetooth-85w-e27-anh-sang-vang-trang-hang-chinh-hang-smart-homekit-i371016057.html
Bóng đèn thông minh Philips Hue White and Color Ambiance E27 Bluetooth 9W 16 triệu màu - Hàng Chính Hãng,Smart Homekit,5.0,2 đánh giá,"₫1,190,000",20 sold,https://www.lazada.vn/products/bong-den-thong-minh-philips-hue-white-and-color-ambiance-e27-bluetooth-9w-16-trieu-mau-hang-chinh-hang-i370246556.html
[TẶNG PK] Kính VR META Quest 3 - Meta Quest 3S và Meta Quest 2 by Oculus phiên bản 128GB và 256GB và 512GB,DroidShop.VN 1629191079,5.0,15 đánh giá,"₫7,990,000",44 sold,https://www.lazada.vn/products/tang-pk-kinh-vr-meta-quest-3-meta-quest-3s-va-meta-quest-2-by-oculus-phien-ban-128gb-va-256gb-va-512gb-i1484960625.html
Ngshizandalacanyi Oculus Quest/quyền/Quest 2 VR tất cả trong một máy kính hút nam châm khung có thể được kết hợp với ống kính cận thị di động VR,ngshizandalacanyi,0,Không có đánh giá,"₫263,752",N/A,https://www.lazada.vn/products/ngshizandalacanyi-oculus-questquyenquest-2-vr-tat-ca-trong-mot-may-kinh-hut-nam-cham-khung-co-the-duoc-ket-hop-voi-ong-kinh-can-thi-di-dong-vr-i2598669107.html
💖Bản gốc + Miễn phí vận chuyển + cá tuyết💖S8 retro máy chơi game console cầm tay 520 trò chơi trạm ánh sáng di động 复古儿童游戏机掌机,Không tìm thấy cửa hàng,0,Không có đánh giá,"₫177,000",16 sold,https://www.lazada.vn/products/ban-goc-mien-phi-van-chuyen-ca-tuyets8-retro-may-choi-game-console-cam-tay-520-tro-choi-tram-anh-sang-di-dong-i2368579763.html
"Game Stick 4k V2 Pro 2023, 64GB-20.000 Trò + 50 Game Mới Tải Thêm, Game Stick M15 Máy Chơi Game Cầm Tay Không Dây",Không tìm thấy cửa hàng,0,Không có đánh giá,"₫329,000",1.3K sold,https://www.lazada.vn/products/game-stick-4k-v2-pro-2023-64gb-20000-tro-50-game-moi-tai-them-game-stick-m15-may-choi-game-cam-tay-khong-day-i2426922286.html
GUDGA DDR3 4GB 8GB RAM Bộ nhớ máy tính để bàn 1600 Mhz 1.5V 240 Pin Máy tính để bàn Dimmable PC DDR3 RAM DDR3 8GB 4GB RAM máy tính để bàn,Không tìm thấy cửa hàng,0,Không có đánh giá,"₫163,900",233 sold,https://www.lazada.vn/products/gudga-ddr3-4gb-8gb-ram-bo-nho-may-tinh-de-ban-1600-mhz-15v-240-pin-may-tinh-de-ban-dimmable-pc-ddr3-ram-ddr3-8gb-4gb-ram-may-tinh-de-ban-i2258865580.html
Ram PC Kingston DDR3 8GB Bus 1600MHz -,Không tìm thấy cửa hàng,0,Không có đánh giá,"₫159,000",2.6K sold,https://www.lazada.vn/products/ram-pc-kingston-ddr3-8gb-bus-1600mhz-i320496944.html
