product_name,store_name,rating,comment_count,price,sold,link
"[HCM]Thẻ nhớ 64gb, Thẻ nhớ camera YOOSEE MicroSDHC 64G Class 10 chuyên dụng cho Camera",Không tìm thấy cửa hàng,0,Không có đánh giá,"₫84,800",594 sold,https://www.lazada.vn/products/hcmthe-nho-64gb-the-nho-camera-yoosee-microsdhc-64g-class-10-chuyen-dung-cho-camera-i2669047404.html
"[HCM]Thẻ nhớ 32gb, Thẻ nhớ camera YOOSEE MicroSDHC 32G Class 10 chuyên dụng cho Camera",Không tìm thấy cửa hàng,0,Không có đánh giá,"₫66,000",3.8K sold,https://www.lazada.vn/products/hcmthe-nho-32gb-the-nho-camera-yoosee-microsdhc-32g-class-10-chuyen-dung-cho-camera-i538700590.html
Thẻ nhớ TF 16GB 32GB 64GB 128GB 256GB 512GB 1TB điện thoại Android máy tính bảng Camera giám sát tốc độ cao 100m thẻ SD Máy ghi âm lái xe THẺ FLASH phổ Micro SD SDXC Thẻ,Không tìm thấy cửa hàng,0,Không có đánh giá,"₫49,000",561 sold,https://www.lazada.vn/products/the-nho-tf-16gb-32gb-64gb-128gb-256gb-512gb-1tb-dien-thoai-android-may-tinh-bang-camera-giam-sat-toc-do-cao-100m-the-sd-may-ghi-am-lai-xe-the-flash-pho-micro-sd-sdxc-the-i2333723138.html
Thẻ Nhớ Kioxia 32GB và Thẻ Nhớ Sandisk (64GB/128GB/256GB) Chính Hãng - EZVIZ Hoang Nguyen Authorized Store,EZVIZ VN Authorized Store,5.0,750 đánh giá,"₫159,000",2.8K sold,https://www.lazada.vn/products/the-nho-kioxia-32gb-va-the-nho-sandisk-64gb128gb256gb-chinh-hang-ezviz-hoang-nguyen-authorized-store-i1428010198.html
"Thẻ Nhớ 32 gb ( Thẻ nhớ dành chuyên cho camera, máy chụp ảnh, quay phim, loa,....)",Không tìm thấy cửa hàng,0,Không có đánh giá,"₫25,000",96 sold,https://www.lazada.vn/products/the-nho-32-gb-the-nho-danh-chuyen-cho-camera-may-chup-anh-quay-phim-loa-i2239681666.html
Xiaomi Mini SD Memory Card 16GB 32GB 64GB TF Card 512GB/128GB/1TB class10 SD Memory Card for Smartphone Computers,Không tìm thấy cửa hàng,0,Không có đánh giá,"₫51,000",1.5K sold,https://www.lazada.vn/products/xiaomi-mini-sd-memory-card-16gb-32gb-64gb-tf-card-512gb128gb1tb-class10-sd-memory-card-for-smartphone-computers-i2552454042.html
Thẻ Nhớ Micro SD 8GB,Không tìm thấy cửa hàng,0,Không có đánh giá,"₫30,779",4.1K sold,https://www.lazada.vn/products/the-nho-micro-sd-8gb-i262318973.html
"Thẻ nhớ 64GB 32GB YOOSEE Class 10, Thẻ nhớ Yoosee camera IP wifi, Điện thoại, loa đài - Bảo hành 5 năm 1 đổi 1",Không tìm thấy cửa hàng,0,Không có đánh giá,"₫67,500",151 sold,https://www.lazada.vn/products/the-nho-64gb-32gb-yoosee-class-10-the-nho-yoosee-camera-ip-wifi-dien-thoai-loa-dai-bao-hanh-5-nam-1-doi-1-i2249602421.html
"Samsung Micro SD 32GB C10 64GB memory TF memory card MicroSD 128GB 256GB 512GB for cameras, drones, mobile phones, and computers",Không tìm thấy cửa hàng,0,Không có đánh giá,"₫41,000",983 sold,https://www.lazada.vn/products/samsung-micro-sd-32gb-c10-64gb-memory-tf-memory-card-microsd-128gb-256gb-512gb-for-cameras-drones-mobile-phones-and-computers-i2530752443.html
♥COD + Thẻ Nhớ Micro SD TOSHIBA Chính Hãng Chính Hãng 100% Thẻ TF 128GB UHS-I Thẻ Nhớ Flash MicroSDXC U3 128GB Micro SDHC128GB Class10 M303,sbiqdn store,4.6,1016 đánh giá,"₫32,000",4.7K sold,https://www.lazada.vn/products/cod-the-nho-micro-sd-toshiba-chinh-hang-chinh-hang-100-the-tf-128gb-uhs-i-the-nho-flash-microsdxc-u3-128gb-micro-sdhc128gb-class10-m303-i1115472142.html
Xraydisk TF Thẻ 64G 128GB 256GB Thẻ nhớ tốc độ cao với bộ chuyển đổi A1 U3 Lớp 10 V30 cho điện thoại/máy ảnh/Dash,Không tìm thấy cửa hàng,0,Không có đánh giá,"₫95,100",5.6K sold,https://www.lazada.vn/products/xraydisk-tf-the-64g-128gb-256gb-the-nho-toc-do-cao-voi-bo-chuyen-doi-a1-u3-lop-10-v30-cho-dien-thoaimay-anhdash-i2506628987.html
GIÁ XUẤT KHO Thẻ nhớ lưu trữ Micro SD Class 10 dung lượng 8GB - 16GB - 32GB - 64GB,Không tìm thấy cửa hàng,0,Không có đánh giá,"₫45,000",3.4K sold,https://www.lazada.vn/products/gia-xuat-kho-the-nho-luu-tru-micro-sd-class-10-dung-luong-8gb-16gb-32gb-64gb-i494192401.html
【Thanh Toán Khi Nhận Hàng】thẻ Nhớ Micro SD 16GB/32GB/64GB/128GB/256/512GB Bộ Chuyển Đổi Siêu SD Miễn Phí Đầu Đọc Thẻ Tf,Không tìm thấy cửa hàng,0,Không có đánh giá,"₫59,000",1.0K sold,https://www.lazada.vn/products/thanh-toan-khi-nhan-hangthe-nho-micro-sd-16gb32gb64gb128gb256512gb-bo-chuyen-doi-sieu-sd-mien-phi-dau-doc-the-tf-i2096001836.html
"Thẻ nhớ MICRO SD 32Gb 16Gb 8Gb 4Gb 2Gb, Thẻ nhớ cho Camera, Loa Bluetooth Tốc độ cao Micro SD-HC Class10, Bảo hành 12 tháng 1 đổi 1",Không tìm thấy cửa hàng,0,Không có đánh giá,"₫47,900",295 sold,https://www.lazada.vn/products/the-nho-micro-sd-32gb-16gb-8gb-4gb-2gb-the-nho-cho-camera-loa-bluetooth-toc-do-cao-micro-sd-hc-class10-bao-hanh-12-thang-1-doi-1-i818766384.html
Thẻ nhớ Robot thẻ nhớ Micro SDHD TF dung lượng 32Gb 64Gb tốc độ xử lý cao chuyên dụng loa máy chơi game nintendo switch camera wifi hành trình điện thoại samsung xiaomi asus vivo oppo huawei realme google l hàng chính hãng,Không tìm thấy cửa hàng,0,Không có đánh giá,"₫69,000",6.9K sold,https://www.lazada.vn/products/the-nho-robot-the-nho-micro-sdhd-tf-dung-luong-32gb-64gb-toc-do-xu-ly-cao-chuyen-dung-loa-may-choi-game-nintendo-switch-camera-wifi-hanh-trinh-dien-thoai-samsung-xiaomi-asus-vivo-oppo-huawei-realme-google-l-hang-chinh-hang-i1245319946.html
Thẻ nhớ microsd 4gb đã Format,Không tìm thấy cửa hàng,0,Không có đánh giá,"₫23,000",1.9K sold,https://www.lazada.vn/products/the-nho-microsd-4gb-da-format-i2165881361.html
💞【Readystock】 + Giao hàng miễn phí + cá tuyết💞 Đầu thẻ Micro SD Class 10 thẻ TF 8GB 16GB 32GB 64GB 128GB 256GB 512GB 1024GB Lên đến 98 MB/giây Thẻ Nhớ Cho Điện Thoại Máy Tính Bảng THẺ FLASH,AUGUST-MALL ZERO,4.5,95 đánh giá,"₫69,000",281 sold,https://www.lazada.vn/products/readystock-giao-hang-mien-phi-ca-tuyet-dau-the-micro-sd-class-10-the-tf-8gb-16gb-32gb-64gb-128gb-256gb-512gb-1024gb-len-den-98-mbgiay-the-nho-cho-dien-thoai-may-tinh-bang-the-flash-i2618304070.html
Thẻ nhớ microsd 1gb đã format,Không tìm thấy cửa hàng,0,Không có đánh giá,"₫19,000",1.9K sold,https://www.lazada.vn/products/the-nho-microsd-1gb-da-format-i2165883194.html
[HCM]Thẻ Nhớ Yoosee Pro Plus 64GB A1 U3 4K R95MB.s W45MB.s [Đỏ] - Chuyên Camera và Điện Thoại,Không tìm thấy cửa hàng,0,Không có đánh giá,"₫89,000",7.3K sold,https://www.lazada.vn/products/hcmthe-nho-yoosee-pro-plus-64gb-a1-u3-4k-r95mbs-w45mbs-do-chuyen-camera-va-dien-thoai-i1220609504.html
Thẻ Nhớ Yoosee Pro Plus 64GB A1 U3 4K R95MB.s W45MB.s [Đỏ] - Chuyên Camera và Điện Thoại,Không tìm thấy cửa hàng,0,Không có đánh giá,"₫89,000",741 sold,https://www.lazada.vn/products/the-nho-yoosee-pro-plus-64gb-a1-u3-4k-r95mbs-w45mbs-do-chuyen-camera-va-dien-thoai-i2530265995.html
Thẻ Nhớ TF Máy Tính Bảng Điện Thoại Android 16GB 32GB 64GB 128GB 256GB 512GB Camera Giám Sát Thẻ Nhớ Tốc Độ Cao Đọc 100M Thẻ Chuyển Mạch SDCS2 Thẻ SD Máy Ghi Âm Lái Xe THẺ Flash Thẻ Micro SD Thông Dụng a1 UHS-I Speed Class 10 (U1) Hoàn Toàn Mới,Không tìm thấy cửa hàng,0,Không có đánh giá,"₫70,000",3.8K sold,https://www.lazada.vn/products/the-nho-tf-may-tinh-bang-dien-thoai-android-16gb-32gb-64gb-128gb-256gb-512gb-camera-giam-sat-the-nho-toc-do-cao-doc-100m-the-chuyen-mach-sdcs2-the-sd-may-ghi-am-lai-xe-the-flash-the-micro-sd-thong-dung-a1-uhs-i-speed-class-10-u1-hoan-toan-moi-i1986303051.html
Sony Thẻ nhớ Micro SD 32GB/64GB/128GB/256GB/512GB/1024GB tốc độ cao lớp 10 UHS-1 Thẻ TF,Electronic Collection Shop,4.7,36 đánh giá,"₫75,000",48 sold,https://www.lazada.vn/products/sony-the-nho-micro-sd-32gb64gb128gb256gb512gb1024gb-toc-do-cao-lop-10-uhs-1-the-tf-i2660775507.html
♥COD100 % Thẻ SD Kingston Chính Hãng 128GB 64GB 32GB 16GB Thẻ Nhớ Class10 Cartao De Memoria SDHC SDXC UHS-I HD Video Carte Sd Cho Máy Ảnh,Không tìm thấy cửa hàng,0,Không có đánh giá,"₫66,000",344 sold,https://www.lazada.vn/products/cod100-the-sd-kingston-chinh-hang-128gb-64gb-32gb-16gb-the-nho-class10-cartao-de-memoria-sdhc-sdxc-uhs-i-hd-video-carte-sd-cho-may-anh-i1111022216.html
Thẻ Nhớ Cũ Micro Sd.256mb.512mb.1gb.2gb.4gb.8gb.16gb.32gb.Bảo hành 6 Tháng.,Không tìm thấy cửa hàng,0,Không có đánh giá,"₫18,000",1.4K sold,https://www.lazada.vn/products/the-nho-cu-micro-sd256mb512mb1gb2gb4gb8gb16gb32gbbao-hanh-6-thang-i1886709356.html
Xiaomi Micro Flash Card 128gb 64gb 256gb 512gb 32gb 128gb Mini SD Card class 10 tf Card 16gb Waterproof and anti magnetic,Không tìm thấy cửa hàng,0,Không có đánh giá,"₫55,000",352 sold,https://www.lazada.vn/products/xiaomi-micro-flash-card-128gb-64gb-256gb-512gb-32gb-128gb-mini-sd-card-class-10-tf-card-16gb-waterproof-and-anti-magnetic-i2395690398.html
Thẻ nhớ 2G Thẻ Nhớ Micro SD Dung Lượng 2G Giao Ngẫu Nhiên - KEN warehouse,KEN warehouse,5.0,3 đánh giá,"₫22,000",41 sold,https://www.lazada.vn/products/the-nho-2g-the-nho-micro-sd-dung-luong-2g-giao-ngau-nhien-ken-warehouse-i2579859445.html
"[Thẻ nhớ 128g] Thẻ Nhớ 128GB chuyên dụng CAMERA, Điện thoại,Máy ảnh nhập khẩu - Cam kết hàng chất lượng,sfdfđ - dungtrung77",Lazano Shop,3.7,7 đánh giá,"₫33,000",54 sold,https://www.lazada.vn/products/the-nho-128g-the-nho-128gb-chuyen-dung-camera-dien-thoaimay-anh-nhap-khau-cam-ket-hang-chat-luongsfdfd-dungtrung77-i2744169777.html
Thẻ nhớ microSDHC Yoosee Extreme Plus 64GB UHS-I U3 4K R90MB/s W40MB/s (Trắng xanh) - chuyên camera và điện thoại,Không tìm thấy cửa hàng,0,Không có đánh giá,"₫85,900",2.0K sold,https://www.lazada.vn/products/the-nho-microsdhc-yoosee-extreme-plus-64gb-uhs-i-u3-4k-r90mbs-w40mbs-trang-xanh-chuyen-camera-va-dien-thoai-i625014251.html
?? Miễn Phí Vận Chuyển + COD?? Thẻ Nhớ Samsung 1024GB 512GB 256GB 128GB Tốc Độ Cao 100 MB/giây MicroSDXC U3 Class10 Thẻ TF,Không tìm thấy cửa hàng,0,Không có đánh giá,"₫32,000",912 sold,https://www.lazada.vn/products/mien-phi-van-chuyen-cod-the-nho-samsung-1024gb-512gb-256gb-128gb-toc-do-cao-100-mbgiay-microsdxc-u3-class10-the-tf-i1602803109.html
Thẻ nhớ MicroSD Mixie 64GB U3 Class 10,Không tìm thấy cửa hàng,0,Không có đánh giá,"₫100,000",1.2K sold,https://www.lazada.vn/products/the-nho-microsd-mixie-64gb-u3-class-10-i1964143418.html
"Thẻ Nhớ Cũ Micro SD,256mb.512mb.1gb.2gb.4gb.8gb 16gb.32gb.Bảo hành 6 tháng.",Không tìm thấy cửa hàng,0,Không có đánh giá,"₫23,000",5.2K sold,https://www.lazada.vn/products/the-nho-cu-micro-sd256mb512mb1gb2gb4gb8gb-16gb32gbbao-hanh-6-thang-i1790145685.html
[LAZMALL] Thẻ Nhớ Micro SD HIKVISION 32GB Class 10 - EZVIZ Hàng Chính Hãng,EZVIZ VN Authorized Store,4.9,116 đánh giá,"₫84,170",655 sold,https://www.lazada.vn/products/lazmall-the-nho-micro-sd-hikvision-32gb-class-10-ezviz-hang-chinh-hang-i1304118870.html
ORICO Thẻ Nhớ SD 8GB/16GB/32GB/64GB/128GB/256GB 80 MB/giây Thẻ TF Mini Thẻ Flash (MSQ1),Không tìm thấy cửa hàng,0,Không có đánh giá,"₫47,853",5.0K sold,https://www.lazada.vn/products/orico-the-nho-sd-8gb16gb32gb64gb128gb256gb-80-mbgiay-the-tf-mini-the-flash-msq1-i1497952413.html
[HCM]Thẻ nhớ microSDHC Yoosee Extreme Plus 32GB/64GB UHS-I U3 4K R90MB/s W40MB/s (Trắng ) - chuyên camera và điện thoại,Không tìm thấy cửa hàng,0,Không có đánh giá,"₫75,300",13.0K sold,https://www.lazada.vn/products/hcmthe-nho-microsdhc-yoosee-extreme-plus-32gb64gb-uhs-i-u3-4k-r90mbs-w40mbs-trang-chuyen-camera-va-dien-thoai-i331466779.html
Thẻ nhớ Hikvision 64G Micro SD Class 10 - EZVIZ Hoang Nguyen Authorized Store,Không tìm thấy cửa hàng,0,Không có đánh giá,"₫129,000",289 sold,https://www.lazada.vn/products/the-nho-hikvision-64g-micro-sd-class-10-ezviz-hoang-nguyen-authorized-store-i1621787013.html
Thẻ Nhớ Micro SD 2GB,Không tìm thấy cửa hàng,0,Không có đánh giá,"₫23,779",3.8K sold,https://www.lazada.vn/products/the-nho-micro-sd-2gb-i262332295.html
Thẻ Nhớ MicroSD 32GB/64GB/128GB/256GB/512GB Tốc Độ Cao Class 10,Không tìm thấy cửa hàng,0,Không có đánh giá,"₫58,888",35 sold,https://www.lazada.vn/products/the-nho-microsd-32gb64gb128gb256gb512gb-toc-do-cao-class-10-i2372649181.html
[Còn Hàng] Thẻ Nhớ Kỹ Thuật Số Bảo Mật Siêu Nhỏ TF Tốc Độ Cao Mini 128G/256G/512G/1T Cho Điện Thoại,tanjiaxun48297,Không có đánh giá,557 đánh giá,"₫24,137",2.5K sold,https://www.lazada.vn/products/con-hang-the-nho-ky-thuat-so-bao-mat-sieu-nho-tf-toc-do-cao-mini-128g256g512g1t-cho-dien-thoai-i1099770055.html
Xiaomi Thẻ Nhớ Micro Tốc Độ Cao 16GB Thẻ Micro SD XC Microsd Camera Giám Sát Di Động Thẻ TF Thẻ Nhớ Di Động C10 32GB 64GB Thẻ Nhớ 512GB 256GB 128GB,Không tìm thấy cửa hàng,0,Không có đánh giá,"₫76,000",8.9K sold,https://www.lazada.vn/products/xiaomi-the-nho-micro-toc-do-cao-16gb-the-micro-sd-xc-microsd-camera-giam-sat-di-dong-the-tf-the-nho-di-dong-c10-32gb-64gb-the-nho-512gb-256gb-128gb-i1972555978.html
"Thẻ Nhớ IMOU 128GB/64GB/32GB Tốc Độ Cao,Chuyên Dụng Cho Camera Wifi, Camera Hành Trình, Điện Thoại, Thiết Bị Điện Tử Chính Hãng DSS",Không tìm thấy cửa hàng,0,Không có đánh giá,"₫99,000",1.6K sold,https://www.lazada.vn/products/the-nho-imou-128gb64gb32gb-toc-do-caochuyen-dung-cho-camera-wifi-camera-hanh-trinh-dien-thoai-thiet-bi-dien-tu-chinh-hang-dss-i1875160691.html
X2 trẻ em Mini máy ảnh kỹ thuật số có thể chụp ảnh video nhỏ SLR đồ chơi,Không tìm thấy cửa hàng,0,Không có đánh giá,"₫90,200",1.3K sold,https://www.lazada.vn/products/x2-tre-em-mini-may-anh-ky-thuat-so-co-the-chup-anh-video-nho-slr-do-choi-i2434398950.html
-CLUBLU- Máy Ảnh Mini in Nhiệt Chụp Lấy Liền Kỹ Thuật Số Camera Y6E Với 2 Cuộn Giấy Nhiệt Cho Bé,Không tìm thấy cửa hàng,0,Không có đánh giá,"₫399,000",65 sold,https://www.lazada.vn/products/clublu-may-anh-mini-in-nhiet-chup-lay-lien-ky-thuat-so-camera-y6e-voi-2-cuon-giay-nhiet-cho-be-i2719152276.html
SP[Giao hàng 24H]Máy ảnh kỹ thuật số mini chống sốc 8MP HD có thể sạc lại cho bé,Không tìm thấy cửa hàng,0,Không có đánh giá,"₫104,000",33 sold,https://www.lazada.vn/products/spgiao-hang-24hmay-anh-ky-thuat-so-mini-chong-soc-8mp-hd-co-the-sac-lai-cho-be-i2344077878.html
Cam Máy ghi âm Ghi hình ảnh 3 trong 1 Máy ghi hình kỹ thuật số bút không dây cầm tay đủ máy ảnh nhỏ gọn Độ nét cao 1080P,Không tìm thấy cửa hàng,0,Không có đánh giá,"₫368,400",11 sold,https://www.lazada.vn/products/cam-may-ghi-am-ghi-hinh-anh-3-trong-1-may-ghi-hinh-ky-thuat-so-but-khong-day-cam-tay-du-may-anh-nho-gon-do-net-cao-1080p-i2714739259.html
"[Tặng thẻ nhớ] Máy ảnh kĩ thuật số digital mini camera v2 - quay, chụp 48MP, siêu mỏng nhỏ gọn",Không tìm thấy cửa hàng,0,Không có đánh giá,"₫789,000",23 sold,https://www.lazada.vn/products/tang-the-nho-may-anh-ki-thuat-so-digital-mini-camera-v2-quay-chup-48mp-sieu-mong-nho-gon-i2378092693.html
PULUZ Q12 Máy Ảnh Kỹ Thuật Số 48MP HD Chụp Ảnh Nhỏ Gọn Thẻ Máy Ảnh Người Mới Bắt Đầu Thân Thiện Có Thể Thu Vào Kích Thước Nhỏ Quà Tặng Chụp Ảnh,Không tìm thấy cửa hàng,0,Không có đánh giá,"₫495,000",294 sold,https://www.lazada.vn/products/puluz-q12-may-anh-ky-thuat-so-48mp-hd-chup-anh-nho-gon-the-may-anh-nguoi-moi-bat-dau-than-thien-co-the-thu-vao-kich-thuoc-nho-qua-tang-chup-anh-i2661060681.html
Máy ảnh kỹ thuật số nhiếp ảnh 16MP máy ảnh vlogging với 16X Thu phóng kỹ thuật số nhỏ gọn dễ dàng sử dụng máy quay video cho du lịch văn phòng nhà cửa,Không tìm thấy cửa hàng,0,Không có đánh giá,"₫549,994",28 sold,https://www.lazada.vn/products/may-anh-ky-thuat-so-nhiep-anh-16mp-may-anh-vlogging-voi-16x-thu-phong-ky-thuat-so-nho-gon-de-dang-su-dung-may-quay-video-cho-du-lich-van-phong-nha-cua-i2417711924.html
A9 Wifi Mini Máy ảnh không dây Video Recorder ghi âm an ninh giám sát máy ảnh nhà thông minh cho trẻ sơ sinh và vật nuôi,Không tìm thấy cửa hàng,0,Không có đánh giá,"₫72,300",367 sold,https://www.lazada.vn/products/a9-wifi-mini-may-anh-khong-day-video-recorder-ghi-am-an-ninh-giam-sat-may-anh-nha-thong-minh-cho-tre-so-sinh-va-vat-nuoi-i2434580567.html
Hộp Đựng Ổ Cứng ORICO Chuyển Đổi HDD Sata Sang USB 3.0 5Gbps 4TB SSD HHD 2.5 inch (25PW1- U3). Hàng chính hãng,Không tìm thấy cửa hàng,0,Không có đánh giá,"₫54,900",13 sold,https://www.lazada.vn/products/hop-dung-o-cung-orico-chuyen-doi-hdd-sata-sang-usb-30-5gbps-4tb-ssd-hhd-25-inch-25pw1-u3-hang-chinh-hang-i2029815128.html
"Hộp đựng ổ cứng USB bên ngoài HDD 2,5 inch Hộp đựng dây kéo để lưu trữ tai nghe Ssd Hhd",Global Merch Park,0,Không có đánh giá,"₫30,700",139 sold,https://www.lazada.vn/products/hop-dung-o-cung-usb-ben-ngoai-hdd-25-inch-hop-dung-day-keo-de-luu-tru-tai-nghe-ssd-hhd-i2723432781.html
Ổ Đĩa SSD Máy Tính Xách Tay Abdo 480GB 120G/128GB 240GB/256GB 512GB Cho Máy Tính Để Bàn Và Máy Tính Xách Tay SATA Mới,TAO Hard Tools,4.9,7 đánh giá,"₫132,000",2.0K sold,https://www.lazada.vn/products/o-dia-ssd-may-tinh-xach-tay-abdo-480gb-120g128gb-240gb256gb-512gb-cho-may-tinh-de-ban-va-may-tinh-xach-tay-sata-moi-i2524355654.html
BH 12 tháng SSD cài sẵn WlN 120GB 240GB 500GB 1TB ổ cứng ssd laptop pc 32GB 64GB 64G 128GB 256GB 240G 512GB 480GB 120G tháo máy,Linh kiện máy tính BCC,Không có đánh giá,156 đánh giá,"₫255,636",345 sold,https://www.lazada.vn/products/bh-12-thang-ssd-cai-san-wln-120gb-240gb-500gb-1tb-o-cung-ssd-laptop-pc-32gb-64gb-64g-128gb-256gb-240g-512gb-480gb-120g-thao-may-i2570298726.html
Ổ SSD HDD 2.5 ổ cứng SSD 120GB 240GB 1TB 512GB 128GB 256GB HD SATA Đĩa ổ cứng trong Cho laptop máy tính Kingspec,KingSpec,4.9,1133 đánh giá,"₫359,100",6.6K sold,https://www.lazada.vn/products/o-ssd-hdd-25-o-cung-ssd-120gb-240gb-1tb-512gb-128gb-256gb-hd-sata-dia-o-cung-trong-cho-laptop-may-tinh-kingspec-i1251437452.html
"ORICO SSD 2.5 ""SSD 128GB 256GB 512GB 1TB ổ cứng lưu trữ thể rắn/tốc độ cao SSD SATA III cho Máy tính để bàn máy tính xách tay",Không tìm thấy cửa hàng,0,Không có đánh giá,"₫217,974",338 sold,https://www.lazada.vn/products/orico-ssd-25-ssd-128gb-256gb-512gb-1tb-o-cung-luu-tru-the-rantoc-do-cao-ssd-sata-iii-cho-may-tinh-de-ban-may-tinh-xach-tay-i2699673575.html
Kingspec 2.5 inche Dung lượng SSD 128GB 256GB 512GB 1TB 2TB 4TB SSD 120GB 240g 480GB 960GB SSD SATA3 Ổ cứng lưu trữ thể rắn nội bộ cho máy tính xách tay Máy tính để bàn Sata đĩa,Không tìm thấy cửa hàng,0,Không có đánh giá,"₫1,363,250",23.6K sold,https://www.lazada.vn/products/kingspec-25-inche-dung-luong-ssd-128gb-256gb-512gb-1tb-2tb-4tb-ssd-120gb-240g-480gb-960gb-ssd-sata3-o-cung-luu-tru-the-ran-noi-bo-cho-may-tinh-xach-tay-may-tinh-de-ban-sata-dia-i1251422305.html
Kingspec M.2 Nvme 2280 128GB 256GB 512GB 1Tb M.2 Nội Bộ SSD Ổ cứng lưu trữ thể rắn Cho Máy Tính Xách Tay Và PC,KingSpec,4.9,1210 đánh giá,"₫412,000",4.6K sold,https://www.lazada.vn/products/kingspec-m2-nvme-2280-128gb-256gb-512gb-1tb-m2-noi-bo-ssd-o-cung-luu-tru-the-ran-cho-may-tinh-xach-tay-va-pc-i1260499588.html
"Kingspec Dung Lượng 256GB NVMe 2280 SSD, Với Tối Đa 2 , 500 MB/giây Đọc & 1800 Mb/giây Tốc Độ Ghi Và Bảo Hành 3 Năm",Không tìm thấy cửa hàng,0,Không có đánh giá,"₫1,854,400",2.5K sold,https://www.lazada.vn/products/kingspec-dung-luong-256gb-nvme-2280-ssd-voi-toi-da-2-500-mbgiay-doc-1800-mbgiay-toc-do-ghi-va-bao-hanh-3-nam-i1260840095.html
"Kingspec Dung Lượng 512GB NVMe 2280 SSD, Với Tối Đa 2 , 500 MB/giây Đọc & 1800 Mb/giây Tốc Độ Ghi Và Bảo Hành 3 Năm",Không tìm thấy cửa hàng,0,Không có đánh giá,"₫736,250",1.3K sold,https://www.lazada.vn/products/kingspec-dung-luong-512gb-nvme-2280-ssd-voi-toi-da-2-500-mbgiay-doc-1800-mbgiay-toc-do-ghi-va-bao-hanh-3-nam-i1260707981.html
ORICO SSD 128GB 256GB 512GB 1TB SSD 2.5 Inch Ổ Cứng Thể Rắn Gắn Trong 1TB Cho Máy Tính Để Bàn Máy Tính Xách Tay,Không tìm thấy cửa hàng,0,Không có đánh giá,"₫1,696,378",714 sold,https://www.lazada.vn/products/orico-ssd-128gb-256gb-512gb-1tb-ssd-25-inch-o-cung-the-ran-gan-trong-1tb-cho-may-tinh-de-ban-may-tinh-xach-tay-i2075505458.html
ORICO [lựa chọn đầu tiên] NVMe 2280 SSD M2 SSD M.2 NVMe Dung lượng PCIe SSD 128GB 256GB cho máy tính xách tay Máy tính để bàn thể thao điện tử,Không tìm thấy cửa hàng,0,Không có đánh giá,"₫415,000",229 sold,https://www.lazada.vn/products/orico-lua-chon-dau-tien-nvme-2280-ssd-m2-ssd-m2-nvme-dung-luong-pcie-ssd-128gb-256gb-cho-may-tinh-xach-tay-may-tinh-de-ban-the-thao-dien-tu-i2730427599.html
Kingspec 2.5 inche SATA3 SSD120GB 240GB 480GB 960GB cho máy tính xách tay Máy tính để bàn Sata đĩa 128GB 256GB 512GB 1TB 2TB 4TB 2.5 SATA3 ổ cứng nội bộ SSD,Không tìm thấy cửa hàng,0,Không có đánh giá,"₫232,750",10.2K sold,https://www.lazada.vn/products/kingspec-25-inche-sata3-ssd120gb-240gb-480gb-960gb-cho-may-tinh-xach-tay-may-tinh-de-ban-sata-dia-128gb-256gb-512gb-1tb-2tb-4tb-25-sata3-o-cung-noi-bo-ssd-i1245208404.html
GUDGA 2.5 inche Dung lượng SSD 128GB 256GB 512GB 1TB 2TB 4TB SSD 120GB 240g 480GB SSD SATA3 Ổ cứng lưu trữ thể rắn nội bộ cho máy tính xách tay Máy tính để bàn Sata đĩa,GUDGA,Không có đánh giá,18 đánh giá,"₫1,350,000",55 sold,https://www.lazada.vn/products/gudga-25-inche-dung-luong-ssd-128gb-256gb-512gb-1tb-2tb-4tb-ssd-120gb-240g-480gb-ssd-sata3-o-cung-luu-tru-the-ran-noi-bo-cho-may-tinh-xach-tay-may-tinh-de-ban-sata-dia-i2834513233.html
GUDGA SSD Nmve M2 128GB 256GB 512GB 1TB Ổ Cứng Lưu Trữ Thể Rắn Nvme M2 Ổ Ổ Cứng SSD M.2 2280 PCIe 3.0 Cho Máy Tính Xách Tay Pcie M2 Ổ Máy Tính Để Bàn,GUDGA,4.9,170 đánh giá,"₫754,353",418 sold,https://www.lazada.vn/products/gudga-ssd-nmve-m2-128gb-256gb-512gb-1tb-o-cung-luu-tru-the-ran-nvme-m2-o-o-cung-ssd-m2-2280-pcie-30-cho-may-tinh-xach-tay-pcie-m2-o-may-tinh-de-ban-i2210846036.html
Ổ cứng SSD Kingston A400 Sata 3 - Bảo hành 36 tháng,Không tìm thấy cửa hàng,0,Không có đánh giá,"₫579,000",578 sold,https://www.lazada.vn/products/o-cung-ssd-kingston-a400-sata-3-bao-hanh-36-thang-i1340524529.html
KingSpec SSD M2 22X80mm M.2 SATA3 128GB 256GB 512GB 1TB HDD NGFF Ổ Cứng Thể Rắn Cho Máy Tính Để Bàn Đối với PC Máy tính xách tay Màn hình nền,GUDGA,Không có đánh giá,11 đánh giá,"₫287,807",19 sold,https://www.lazada.vn/products/kingspec-ssd-m2-22x80mm-m2-sata3-128gb-256gb-512gb-1tb-hdd-ngff-o-cung-the-ran-cho-may-tinh-de-ban-doi-voi-pc-may-tinh-xach-tay-man-hinh-nen-i2213337876.html
"Ổ CỨNG SSD 128GB, SSD 120GB, SSD 256GB, SSD 512GB 2.5' sata 3, Bảo hành 3 năm",FORAN.STORE,4.8,21 đánh giá,"₫199,999",150 sold,https://www.lazada.vn/products/o-cung-ssd-128gb-ssd-120gb-ssd-256gb-ssd-512gb-25-sata-3-bao-hanh-3-nam-i2054095795.html
SSD M2 Sata 128GB chuẩn 2280 tháo máy bộ Mỹ nhiều hãng Samsung/SK Hynix/WD/PNY/Sandisk - Hàng nguyên zin đẹp tháo máy,laptopductri,4.6,32 đánh giá,"₫189,000",85 sold,https://www.lazada.vn/products/ssd-m2-sata-128gb-chuan-2280-thao-may-bo-my-nhieu-hang-samsungsk-hynixwdpnysandisk-hang-nguyen-zin-dep-thao-may-i2340316659.html
Somnambulist Ssd Nội Bộ Sata3 Ổ Cứng Thể Rắn 2.5 Inch Cho Máy Tính Laptop 120gb/240gb/480gb/960gb/128gb/256gb/512gb/1tb/2tb,Global Merch Park,0,Không có đánh giá,"₫186,048",10 sold,https://www.lazada.vn/products/somnambulist-ssd-noi-bo-sata3-o-cung-the-ran-25-inch-cho-may-tinh-laptop-120gb240gb480gb960gb128gb256gb512gb1tb2tb-i2759860068.html
GUDGA M.2 SSD 120GB 256GB 512GB 1TB SSD 2TB Ổ cứng M2 SSD M.2 NVMe pcie 3.0X4 SSD Máy tính xách tay Máy tính để bàn Ổ cứng nội bộ MSI,Không tìm thấy cửa hàng,0,Không có đánh giá,"₫292,908",38 sold,https://www.lazada.vn/products/gudga-m2-ssd-120gb-256gb-512gb-1tb-ssd-2tb-o-cung-m2-ssd-m2-nvme-pcie-30x4-ssd-may-tinh-xach-tay-may-tinh-de-ban-o-cung-noi-bo-msi-i2265041329.html
Củ loa kép bốn loa âm bass mạnh Tai nghe nhạc thể thao điều khiển bằng dây tai nghe,Không tìm thấy cửa hàng,0,Không có đánh giá,"₫9,500",12.6K sold,https://www.lazada.vn/products/cu-loa-kep-bon-loa-am-bass-manh-tai-nghe-nhac-the-thao-dieu-khien-bang-day-tai-nghe-i2522771137.html
"[ SALE CHÍNH HÃNG ] Loa Bluetooth nghe nhạc không dây Flip6 Flip8 Charge 4+ Charge 3+ Xtreem 3 4, E6+ Bass To thiết kế nhỏ gọn giá rẻ cắm Usb thẻ nhớ Jack AUX Cổng 3.5",Không tìm thấy cửa hàng,0,Không có đánh giá,"₫61,340",12.7K sold,https://www.lazada.vn/products/sale-chinh-hang-loa-bluetooth-nghe-nhac-khong-day-flip6-flip8-charge-4-charge-3-xtreem-3-4-e6-bass-to-thiet-ke-nho-gon-gia-re-cam-usb-the-nho-jack-aux-cong-35-i2302956120.html
