product_name,store_name,rating,comment_count,price,sold,link
"Mic Karaoke - Micro Karaoke - Sân Khấu Giá Rẻ - Micro Không Dây Sạc Pin Uhf Ehoona E-15 Dành Cho Loa Karaoke Xách Tay Di Động, Loa Kẹo Kéo, Loa Bluetooth, Amply Hát Karaoke Tại Nhà, Âm Thanh Trung Thực Chống Hú, Hát Nhẹ, Bắt Giọng Cực Tốt",Không tìm thấy cửa hàng,0,Không có đánh giá,"₫185,000",81 sold,https://www.lazada.vn/products/mic-karaoke-micro-karaoke-san-khau-gia-re-micro-khong-day-sac-pin-uhf-ehoona-e-15-danh-cho-loa-karaoke-xach-tay-di-dong-loa-keo-keo-loa-bluetooth-amply-hat-karaoke-tai-nha-am-thanh-trung-thuc-chong-hu-hat-nhe-bat-giong-cuc-tot-i2165572525.html
"Micro loa kéo giá rẻ, đầu lưới hợp kim inox chống gỉ, hát nhẹ, chống hú tốt",Không tìm thấy cửa hàng,0,Không có đánh giá,"₫284,917",116 sold,https://www.lazada.vn/products/micro-loa-keo-gia-re-dau-luoi-hop-kim-inox-chong-gi-hat-nhe-chong-hu-tot-i2594153575.html
Micro Không Dây Uhf Chuyên Nghiệp 2 Kênh Mic Hiệu Suất Sân Khấu Cầm Tay Cho Đảng Karaoke Nhà Thờ Thể Hiện Cuộc Họp Được Chứng Nhận CE,Global Merch Park,Không có đánh giá,471 đánh giá,"₫298,700",1.0K sold,https://www.lazada.vn/products/micro-khong-day-uhf-chuyen-nghiep-2-kenh-mic-hieu-suat-san-khau-cam-tay-cho-dang-karaoke-nha-tho-the-hien-cuoc-hop-duoc-chung-nhan-ce-i2616793416.html
"(Loại 1) Micro thu âm Studio cao cấp BM900 Woaichang, hàng chuẩn",GIATOT.shop (Hà Nội),Không có đánh giá,136 đánh giá,"₫158,600",639 sold,https://www.lazada.vn/products/loai-1-micro-thu-am-studio-cao-cap-bm900-woaichang-hang-chuan-i166051526.html
"Micro thu âm Micro không dây S16 Lọc Ồn Tự Động, Ghi Âm. Quay Video, Livestream, Kết Nối Xa Ổn Định",Hàng Giá Gốc VN1XR5GH,Không có đánh giá,50 đánh giá,"₫351,000",153 sold,https://www.lazada.vn/products/micro-thu-am-micro-khong-day-loc-on-tu-dong-ghi-am-quay-video-livestream-ket-noi-xa-on-dinh-i2356748643.html
Mới Không Dây Lavalier Microphone Âm Thanh Video Ghi Âm Mini Mic Cho Iphone Android Máy Tính Xách Tay Chơi Game Trực Tiếp Điện Thoại Di Động Microphone,Không tìm thấy cửa hàng,0,Không có đánh giá,"₫98,296",162 sold,https://www.lazada.vn/products/moi-khong-day-lavalier-microphone-am-thanh-video-ghi-am-mini-mic-cho-iphone-android-may-tinh-xach-tay-choi-game-truc-tiep-dien-thoai-di-dong-microphone-i2562792630.html
"Micro Tomahawk có dây hàng nhật bãi chuẩn japan,tay mic hợp kim , chữ TOMAHAWK được dập chìm trên tay mic hàng nhập khẩu mới nhất 2024",Không tìm thấy cửa hàng,0,Không có đánh giá,"₫183,000",394 sold,https://www.lazada.vn/products/micro-tomahawk-co-day-hang-nhat-bai-chuan-japantay-mic-hop-kim-chu-tomahawk-duoc-dap-chim-tren-tay-mic-hang-nhap-khau-moi-nhat-2024-i1961224251.html
[ KHUYẾN MÃI KHỦNG- BẢO HANH 1 ĐỔI 1] micro cho mọi loại loa-...... MICRO CHO LOA KÉO BLUETOOTH P88 P89 ...- MICRO dành cho LOA XÁCH TAY- MICRO HÁT KARAOKE SIÊU HAY SIÊU HOT,Shop Hàng Hiệu ZN,4.1,224 đánh giá,"₫49,000",1.2K sold,https://www.lazada.vn/products/khuyen-mai-khung-bao-hanh-1-doi-1-micro-cho-moi-loai-loa-micro-cho-loa-keo-bluetooth-p88-p89-micro-danh-cho-loa-xach-tay-micro-hat-karaoke-sieu-hay-sieu-hot-i1716835446.html
TRọn Bộ 02 micro kèm board kết nối hàng chuẩn tiếng hay,Không tìm thấy cửa hàng,0,Không có đánh giá,"₫189,000",410 sold,https://www.lazada.vn/products/tron-bo-02-micro-kem-board-ket-noi-hang-chuan-tieng-hay-i1855919110.html
Bộ 2 micro thu âm không dây Gutek K9 khử tiếng ồn để livestream livetream ghi âm phát trực tiếp quay video cổng iphone,Không tìm thấy cửa hàng,0,Không có đánh giá,"₫139,000",3.2K sold,https://www.lazada.vn/products/bo-2-micro-thu-am-khong-day-gutek-k9-khu-tieng-on-de-livestream-livetream-ghi-am-phat-truc-tiep-quay-video-cong-iphone-i1982814076.html
Geniusc bài giảng Microphone có thể chỉnh góc microphone âm thanh sắc nét Micro có dây tai nghe 3.5mm lý tưởng cho các hội nghị bài phát biểu và giảng dạy có thể chỉnh góc cho hiệu suất tối ưu plug and play,Không tìm thấy cửa hàng,0,Không có đánh giá,"₫22,687",126 sold,https://www.lazada.vn/products/geniusc-bai-giang-microphone-co-the-chinh-goc-microphone-am-thanh-sac-net-micro-co-day-tai-nghe-35mm-ly-tuong-cho-cac-hoi-nghi-bai-phat-bieu-va-giang-day-co-the-chinh-goc-cho-hieu-suat-toi-uu-plug-and-play-i2364993536.html
[MIỄN SHIP TOÀN QUỐC- BẢO HANH 1 ĐỔI 1] micro cho mọi loại loa-.. MICRO CHO LOA KÉO BLUETOOTH P88 P89 - MICRO dành cho LOA XÁCH TAY- MICRO HÁT KARAOKE CỰC HAY CỰC ĐÃ,Shop Đồ Hiệu Zn,4.0,25 đánh giá,"₫43,000",112 sold,https://www.lazada.vn/products/mien-ship-toan-quoc-bao-hanh-1-doi-1-micro-cho-moi-loai-loa-micro-cho-loa-keo-bluetooth-p88-p89-micro-danh-cho-loa-xach-tay-micro-hat-karaoke-cuc-hay-cuc-da-i2169256840.html
"Micro máy tính MC-NET30 có chân đế dành cho máy tính laptop Công nghệ giảm tiếng ồn, nhiễu (NCC) Dải tần rộng Âm thanh mạnh mẽ",Không tìm thấy cửa hàng,0,Không có đánh giá,"₫70,000",1.5K sold,https://www.lazada.vn/products/micro-may-tinh-mc-net30-co-chan-de-danh-cho-may-tinh-laptop-cong-nghe-giam-tieng-on-nhieu-ncc-dai-tan-rong-am-thanh-manh-me-i101699496.html
(MIỄN SHIP TOÀN QUỐC] micro cho mọi loại loa- MICRO CHO LOA KÉO BLUETOOTH P88 P89 .- MICRO dành cho LOA XÁCH TAY- MICRO HÁT KARAOKE SIÊU HAY,Shop Đồ Hiệu Zn,4.3,6 đánh giá,"₫49,000",22 sold,https://www.lazada.vn/products/mien-ship-toan-quoc-micro-cho-moi-loai-loa-micro-cho-loa-keo-bluetooth-p88-p89-micro-danh-cho-loa-xach-tay-micro-hat-karaoke-sieu-hay-i2170406238.html
Sale giá hủy diệt Micro cài áo mini đầu cắm 3.5mm cho PC Laptop,Không tìm thấy cửa hàng,0,Không có đánh giá,"₫19,500",393 sold,https://www.lazada.vn/products/sale-gia-huy-diet-micro-cai-ao-mini-dau-cam-35mm-cho-pc-laptop-i2016633618.html
"Máy in phun màu Canon MX-397 (in, scan, copy, Fax)",Không tìm thấy cửa hàng,Không có đánh giá,Không có đánh giá,"₫1,180,000",7 sold,https://www.lazada.vn/products/may-in-phun-mau-canon-mx-397-in-scan-copy-fax-i2497946073.html
"MKTEL M14 Tính Năng Điện Thoại Với 4 SIM Chờ Màn Hình 2.4 ""Pin 1100MAh MP3 MP4 Đài FM Cao Cấp Điện Thoại Lật",GlobalLifestyle,Không có đánh giá,2 đánh giá,"₫310,400",116 sold,https://www.lazada.vn/products/mktel-m14-tinh-nang-dien-thoai-voi-4-sim-cho-man-hinh-24-pin-1100mah-mp3-mp4-dai-fm-cao-cap-dien-thoai-lat-i2894553843.html
Máy in laser đa năng (có Fax) Brother MFC-L2701D,Brother,Không có đánh giá,5 đánh giá,"₫5,700,000",18 sold,https://www.lazada.vn/products/may-in-laser-da-nang-co-fax-brother-mfc-l2701d-i886842165.html
Panasonic KX-FT983 Máy Fax Nhiệt Đời Chót,Không tìm thấy cửa hàng,0,Không có đánh giá,"₫2,400,000",11 sold,https://www.lazada.vn/products/panasonic-kx-ft983-may-fax-nhiet-doi-chot-i1263979713.html
"HCM Máy in đa chức năng Laser HP LaserJet Pro M1212nf MFP (in mạng, scan, photo, copy, fax)",Không tìm thấy cửa hàng,Không có đánh giá,Không có đánh giá,"₫2,150,000",7 sold,https://www.lazada.vn/products/hcm-may-in-da-chuc-nang-laser-hp-laserjet-pro-m1212nf-mfp-in-mang-scan-photo-copy-fax-i2616263806.html
[HCM]Film Fax KX - FA 57E cho máy Panasonic KX FP 711,Không tìm thấy cửa hàng,0,Không có đánh giá,"₫120,000",38 sold,https://www.lazada.vn/products/hcmfilm-fax-kx-fa-57e-cho-may-panasonic-kx-fp-711-i2114061.html
"Công tắc cảm biến ánh sáng tự động 10A 220V (AS-10) cong tắc điện thông minh, công tắc cảm ứng ánh sáng",Smart power,Không có đánh giá,224 đánh giá,"₫21,000",3.0K sold,https://www.lazada.vn/products/cong-tac-cam-bien-anh-sang-tu-dong-10a-220v-as-10-cong-tac-dien-thong-minh-cong-tac-cam-ung-anh-sang-i330396156.html
Dây Cảm Biến Bếp Hồng Ngoại,Linh Kiện Điện Tử 3MS Tân Phú,Không có đánh giá,407 đánh giá,"₫13,424",2.7K sold,https://www.lazada.vn/products/day-cam-bien-bep-hong-ngoai-i249177357.html
VOKTTA Công Tắc Cảm Biến Ánh Sáng Bộ Điều Khiển Đèn Đường Chống Nước Công Tắc Cảm Biến Đèn Đường Ống Quang Điện DC 12V 24V AC 220V Công Tắc Đèn Đường Tự Động,VOKTTA Official Store,4.9,276 đánh giá,"₫27,300",3.5K sold,https://www.lazada.vn/products/voktta-cong-tac-cam-bien-anh-sang-bo-dieu-khien-den-duong-chong-nuoc-cong-tac-cam-bien-den-duong-ong-quang-dien-dc-12v-24v-ac-220v-cong-tac-den-duong-tu-dong-i1132382592.html
"Công tắc cảm biến chuyển động hồng ngoại, thiết kế tinh giản dể dàng lắp đặt sử dụng",Wonder Electric Vietnam,4.8,81 đánh giá,"₫23,562",650 sold,https://www.lazada.vn/products/cong-tac-cam-bien-chuyen-dong-hong-ngoai-thiet-ke-tinh-gian-de-dang-lap-dat-su-dung-i2653582986.html
Đầu Dò Cảm Biến Nhiệt Độ Can Nhiệt Can K M6,ĐIỆN ĐIỆN VƯƠNG,5.0,9 đánh giá,"₫23,537",150 sold,https://www.lazada.vn/products/dau-do-cam-bien-nhiet-do-can-nhiet-can-k-m6-i1331508068.html
Dây cảm biến nhiệt bếp hồng ngoại.,iLinhkien,4.9,46 đánh giá,"₫5,485",712 sold,https://www.lazada.vn/products/day-cam-bien-nhiet-bep-hong-ngoai-i1772382848.html
"Thiết bị chuyển đổi bóng đèn thường thành bóng đèn cảm ứng tự động tắt mở khi trời sáng hoặc tối, công tắc cảm biến ánh sáng, Bảo Hành 1 đổi 1 công tắc cảm biến ánh sáng - AS-10-220V",FOXSUR VIỆT NAM,4.9,106 đánh giá,"₫31,700",1.1K sold,https://www.lazada.vn/products/thiet-bi-chuyen-doi-bong-den-thuong-thanh-bong-den-cam-ung-tu-dong-tat-mo-khi-troi-sang-hoac-toi-cong-tac-cam-bien-anh-sang-bao-hanh-1-doi-1-cong-tac-cam-bien-anh-sang-as-10-220v-i1243966332.html
"Bộ điều khiển nhiệt độ tự động Futureworld XH-W3001 10A/220V,mạch điều khiển nhiệt độ,cảm biến nhiệt độ,thiết bị điều khiển nhiệt độ, lò ấp trứng, đầu dò nhiệt độ, đồng hồ cảm biến nhiệt độ",Esc Viet Nam,4.9,41 đánh giá,"₫34,000",338 sold,https://www.lazada.vn/products/bo-dieu-khien-nhiet-do-tu-dong-futureworld-xh-w3001-10a220vmach-dieu-khien-nhiet-docam-bien-nhiet-dothiet-bi-dieu-khien-nhiet-do-lo-ap-trung-dau-do-nhiet-do-dong-ho-cam-bien-nhiet-do-i657828274.html
"[Loại tốt có nút chỉnh thời gian] Công tắc cảm biến chuyển động hồng ngoại , cảm ứng chuyển động",home smart 89,4.8,34 đánh giá,"₫40,000",389 sold,https://www.lazada.vn/products/loai-tot-co-nut-chinh-thoi-gian-cong-tac-cam-bien-chuyen-dong-hong-ngoai-cam-ung-chuyen-dong-i1239923793.html
"Chuông Báo Khách Cửa Hàng, Báo Động Chống Trộm Cảm Biến Hồng Ngoại CTFAST 01 - Chuông Cửa Báo Khách Ghé Thăm, Dọa Trộm Xâm Nhập, Ánh Sáng Đèn Ngủ",CTFAST STORE,Không có đánh giá,27 đánh giá,"₫369,000",114 sold,https://www.lazada.vn/products/chuong-bao-khach-cua-hang-bao-dong-chong-trom-cam-bien-hong-ngoai-ctfast-01-chuong-cua-bao-khach-ghe-tham-doa-trom-xam-nhap-anh-sang-den-ngu-i1269593704.html
Công Tắc Cảm Biến Chuyển Động Hồng Ngoại Ốp Trần BC99,Bình Cương,4.4,30 đánh giá,"₫77,000",200 sold,https://www.lazada.vn/products/cong-tac-cam-bien-chuyen-dong-hong-ngoai-op-tran-bc99-i1261262234.html
"Cảm biến chuyển động hồng ngoại mini , công tắc cảm biến hồng ngoại loại tốt",Điện hà nội 1593314750,4.6,96 đánh giá,"₫24,500",908 sold,https://www.lazada.vn/products/cam-bien-chuyen-dong-hong-ngoai-mini-cong-tac-cam-bien-hong-ngoai-loai-tot-i1583292820.html
Cảm biến nhiệt bếp từ 10K 50K 100K túi 10 con.,iLinhkien,4.9,47 đánh giá,"₫14,122",239 sold,https://www.lazada.vn/products/cam-bien-nhiet-bep-tu-10k-50k-100k-tui-10-con-i1772418539.html
Kebidumei Công Tắc Đèn Đường Tế Bào Quang Điện Tự Động Bật Tắt DC 12V 24V AC 110V 220V Công Tắc Cảm Biến Công Tắc Quang Điều Khiển Ảnh,Kebidumei,5.0,44 đánh giá,"₫34,500",255 sold,https://www.lazada.vn/products/kebidumei-cong-tac-den-duong-te-bao-quang-dien-tu-dong-bat-tat-dc-12v-24v-ac-110v-220v-cong-tac-cam-bien-cong-tac-quang-dieu-khien-anh-i1360938062.html
Bộ cảm biến từ chống trộm gắn cửa MC-31 MC-38,Điện Tử MTU - dientumtu.com,4.7,29 đánh giá,"₫10,000",338 sold,https://www.lazada.vn/products/bo-cam-bien-tu-chong-trom-gan-cua-mc-31-mc-38-i951634849.html
Mạch Cảm Biến Điều Khiển Mực Nước AC9-12V,Linh Kiện 589,5.0,21 đánh giá,"₫30,000",189 sold,https://www.lazada.vn/products/mach-cam-bien-dieu-khien-muc-nuoc-ac9-12v-i1295507253.html
Chuông Báo Khách Chống Trộm Không Dây M10 Cảm Biến Chuyển động,Không tìm thấy cửa hàng,0,Không có đánh giá,"₫80,000",15 sold,https://www.lazada.vn/products/chuong-bao-khach-chong-trom-khong-day-m10-cam-bien-chuyen-dong-i2559128331.html
Cảm biến tiệm cận Fotek PL-05N / Cảm biến tiệm cận Fotek PS-05N Ngõ ra NPN,DIENDIENVUONG,5.0,8 đánh giá,"₫42,000",97 sold,https://www.lazada.vn/products/cam-bien-tiem-can-fotek-pl-05n-cam-bien-tiem-can-fotek-ps-05n-ngo-ra-npn-i2138250951.html
Cảm Biến Nhiệt Độ LM35 Chính Hãng TO-92 - Khoảng Đo -55 đến 150 độ,Linh Kiện Điện Tử ViNa,0,Không có đánh giá,"₫8,900",12 sold,https://www.lazada.vn/products/cam-bien-nhiet-do-lm35-chinh-hang-to-92-khoang-do-55-den-150-do-i2569719603.html
Module cảm biến ánh sáng có Relay 5V 12V XH-M131 (Bật tắt Thiết bị tự động),Điện Tử MTU - dientumtu.com,4.9,99 đánh giá,"₫25,000",629 sold,https://www.lazada.vn/products/module-cam-bien-anh-sang-co-relay-5v-12v-xh-m131-bat-tat-thiet-bi-tu-dong-i951312841.html
Sensor cảm biến nhiệt độ điều hoà dây cảm biến nhiệt độ điều hoà dàn lạnh 5K 10K 15K 20K 25K 30k 50k 100k 200k,MEGA88,4.7,36 đánh giá,"₫10,000",290 sold,https://www.lazada.vn/products/sensor-cam-bien-nhiet-do-dieu-hoa-day-cam-bien-nhiet-do-dieu-hoa-dan-lanh-5k-10k-15k-20k-25k-30k-50k-100k-200k-i2309950401.html
Xe đậu xe cảm biến đậu xe Kit LED hiển thị 22mm 4 cảm biến đèn nền đảo ngược sao lưu Radar hệ thống giám sát 8 màu sắc 12V,Không tìm thấy cửa hàng,0,Không có đánh giá,"₫139,214",2.2K sold,https://www.lazada.vn/products/xe-dau-xe-cam-bien-dau-xe-kit-led-hien-thi-22mm-4-cam-bien-den-nen-dao-nguoc-sao-luu-radar-he-thong-giam-sat-8-mau-sac-12v-i2474063714.html
"( BỘ 10 CÁI ) Mắt tay ga xe điện cảm biến Hall 49E, cảm biến tay ga, IC hall, chip tay ga xe điện",HT2,5.0,33 đánh giá,"₫42,367",186 sold,https://www.lazada.vn/products/bo-10-cai-mat-tay-ga-xe-dien-cam-bien-hall-49e-cam-bien-tay-ga-ic-hall-chip-tay-ga-xe-dien-i1496367496.html
Cảm biến đo độ ẩm HR202 của máy ấp trứng Ánh Dương P100,Máy Ấp Trứng Nam An,5.0,7 đánh giá,"₫30,000",50 sold,https://www.lazada.vn/products/cam-bien-do-do-am-hr202-cua-may-ap-trung-anh-duong-p100-i2080895341.html
Cảm Biến Phát Hiện Kim Loại Tiệm Cận LJ12A3,NSHOP - linh kiện điện tử,Không có đánh giá,9 đánh giá,"₫41,000",313 sold,https://www.lazada.vn/products/cam-bien-phat-hien-kim-loai-tiem-can-lj12a3-i248552224.html
"Cảm biến vẫy tay, chạm, cảm ứng người, đóng mở tủ dành cho led 12V",KIM HUỲNH LIGHTING,4.9,78 đánh giá,"₫49,000",915 sold,https://www.lazada.vn/products/cam-bien-vay-tay-cham-cam-ung-nguoi-dong-mo-tu-danh-cho-led-12v-i2040047153.html
"Báo động cảm biến Pir không dây, Báo động chống trộm tại nhà không dây với điều khiển từ xa, Hệ thống chuyển động, Âm lượng 105dB, Điều khiển từ xa không dây Máy dò nhỏ Cảm biến an ninh gia đình Điều khiển từ xa Báo động hồng ngoại",Good Luck VN,4.8,100 đánh giá,"₫75,004",225 sold,https://www.lazada.vn/products/bao-dong-cam-bien-pir-khong-day-bao-dong-chong-trom-tai-nha-khong-day-voi-dieu-khien-tu-xa-he-thong-chuyen-dong-am-luong-105db-dieu-khien-tu-xa-khong-day-may-do-nho-cam-bien-an-ninh-gia-dinh-dieu-khien-tu-xa-bao-dong-hong-ngoai-i2458198723.html
220V LED Cảm Biến Chuyển Động Cảm Biến Đèn Hồng Ngoại Cảm Biến Tự Động Trong Nhà Ngoài Trời Đèn Ngủ Thông Minh Điều Khiển Trễ,GlobalLifestyle,0,Không có đánh giá,"₫28,000",111 sold,https://www.lazada.vn/products/220v-led-cam-bien-chuyen-dong-cam-bien-den-hong-ngoai-cam-bien-tu-dong-trong-nha-ngoai-troi-den-ngu-thong-minh-dieu-khien-tre-i2910600070.html
"Cảm Biến Hồng Ngoại Chống Trộm Ngoài Trời Đa Năng,Công Tắc Cảm Biến Chuyển Động Hồng Ngoại,Den Cam Ung Chong Trom,Báo động cảm biến,lắp vào chuông báo động chống trộm hiện đại.",TECH GOLD STORE,Không có đánh giá,51 đánh giá,"₫99,000",220 sold,https://www.lazada.vn/products/cam-bien-hong-ngoai-chong-trom-ngoai-troi-da-nangcong-tac-cam-bien-chuyen-dong-hong-ngoaiden-cam-ung-chong-trombao-dong-cam-bienlap-vao-chuong-bao-dong-chong-trom-hien-dai-i534672589.html
Tuya Wifi Nhà Để Xe Mở Cửa 2CH 433 MHz Bộ Thu Điều Khiển Công Tắc Inching Module Relay Ứng Dụng Điều Khiển Từ Xa Tương Thích Với Alexa,GlobalLifestyle,0,Không có đánh giá,"₫68,000",86 sold,https://www.lazada.vn/products/tuya-wifi-nha-de-xe-mo-cua-2ch-433-mhz-bo-thu-dieu-khien-cong-tac-inching-module-relay-ung-dung-dieu-khien-tu-xa-tuong-thich-voi-alexa-i2905810501.html
Mạch Relay cảm biến kiểm soát nhiệt độ 12VDC XH-W1209,ZzSunnyzZ,4.6,14 đánh giá,"₫10,000",104 sold,https://www.lazada.vn/products/mach-relay-cam-bien-kiem-soat-nhiet-do-12vdc-xh-w1209-i1118096368.html
Module điều khiển relay bằng cảm biến độ ẩm đất 12V,Không tìm thấy cửa hàng,0,Không có đánh giá,"₫42,900",12 sold,https://www.lazada.vn/products/module-dieu-khien-relay-bang-cam-bien-do-am-dat-12v-i2611617055.html
CẢM BIẾN CỬA TỪ - MÁ TỪ báo động chống trộm -Tặng PIN AAA,home smart 89,4.8,27 đánh giá,"₫17,000",160 sold,https://www.lazada.vn/products/cam-bien-cua-tu-ma-tu-bao-dong-chong-trom-tang-pin-aaa-i2514671883.html
Hulong Công Tắc Từ Tính Zjwkm12-10zj/k 24v/220v Cảm Biến Cảm Ứng Mở Và Đóng Không Đổi Sản Phẩm Kỹ Thuật Điện Tử,沪龙传感器企业店,5.0,12 đánh giá,"₫59,000",1.4K sold,https://www.lazada.vn/products/hulong-cong-tac-tu-tinh-zjwkm12-10zjk-24v220v-cam-bien-cam-ung-mo-va-dong-khong-doi-san-pham-ky-thuat-dien-tu-i2015433542.html
Công tắc cảm biến ánh sáng - AS-10A,FOXSUR VIỆT NAM,4.8,17 đánh giá,"₫31,700",149 sold,https://www.lazada.vn/products/cong-tac-cam-bien-anh-sang-as-10a-i1243981208.html
RX-Multi 300-868 MHz WiFi & 433 MHz RF Mô-đun Thu Cửa Nhà Để Xe Điều Khiển Với Chức Năng Từ Xa Tuya WiFi Tương Thích Với Cổng 9-30V 85-250V,GlobalLifestyle,0,Không có đánh giá,"₫80,800",125 sold,https://www.lazada.vn/products/rx-multi-300-868-mhz-wifi-433-mhz-rf-mo-dun-thu-cua-nha-de-xe-dieu-khien-voi-chuc-nang-tu-xa-tuya-wifi-tuong-thich-voi-cong-9-30v-85-250v-i2901207320.html
CẢM BIẾN CỬA TỪ - MÁ TỪ báo động chống trộm -PIN AAA,Shop Hoàng Bách,Không có đánh giá,124 đánh giá,"₫22,000",998 sold,https://www.lazada.vn/products/cam-bien-cua-tu-ma-tu-bao-dong-chong-trom-pin-aaa-i450812290.html
Công tắc cảm biến chuyển động hồng ngoại,Home_Technology_89,5.0,1 đánh giá,"₫22,000",44 sold,https://www.lazada.vn/products/cong-tac-cam-bien-chuyen-dong-hong-ngoai-i1671522016.html
[Hàng Hot] Bộ Phát Wifi TP-Link Archer C54 Băng Tần Kép Chuẩn AC 1200Mbps - Hãng phân phối chính thức,TP-Link,Không có đánh giá,1931 đánh giá,"₫389,000",7.9K sold,https://www.lazada.vn/products/hang-hot-bo-phat-wifi-tp-link-archer-c54-bang-tan-kep-chuan-ac-1200mbps-hang-phan-phoi-chinh-thuc-i943274806.html
⚡Miễn Phí Vận Chuyển⚡ Bộ kích sóng wifi râu tốc độ 300mbps phát xuyên tường kết nối xa sóng mạnh,Không tìm thấy cửa hàng,0,Không có đánh giá,"₫126,000",621 sold,https://www.lazada.vn/products/mien-phi-van-chuyen-bo-kich-song-wifi-rau-toc-do-300mbps-phat-xuyen-tuong-ket-noi-xa-song-manh-i2663474588.html
[ BH 6 Tháng ] Bộ Phát Wifi TP-Link 842N 2 râu chuẩn tốc độ 300 Mbps,TTSTore1,Không có đánh giá,154 đánh giá,"₫87,000",642 sold,https://www.lazada.vn/products/bh-6-thang-bo-phat-wifi-tp-link-842n-2-rau-chuan-toc-do-300-mbps-i724400235.html
Tenda N301,Phượng online laz,4.3,25 đánh giá,"₫89,000",168 sold,https://www.lazada.vn/products/tenda-n301-i1867513145.html
Bộ Phát Wifi6 ZTE E2615 chuẩn Ax1800Mbps -Hỗ trợ Mesh,BPK STORE,4.8,54 đánh giá,"₫239,000",243 sold,https://www.lazada.vn/products/bo-phat-wifi6-zte-e2615-chuan-ax1800mbps-ho-tro-mesh-i2589412201.html
"Bộ phát Wifi TPlink 3 râu 880N LIKE NEW 95% sóng xuyên tường tốc độ 450 Mbps, Modem Wifi 3 râu Router wifi Cục Phát Wifi TPLink, thiết bị Kích sóng wifi - Hàng Thanh Ly 95%",WIFI WIFI,Không có đánh giá,47 đánh giá,"₫135,000",215 sold,https://www.lazada.vn/products/bo-phat-wifi-tplink-3-rau-880n-like-new-95-song-xuyen-tuong-toc-do-450-mbps-modem-wifi-3-rau-router-wifi-cuc-phat-wifi-tplink-thiet-bi-kich-song-wifi-hang-thanh-ly-95-i1803575611.html
Bộ phát Wifi Tenda AC6 Băng Tần Kép Chuẩn AC 1200Mbps - Hãng phân phối chính thức,Không tìm thấy cửa hàng,0,Không có đánh giá,"₫394,000",1.6K sold,https://www.lazada.vn/products/bo-phat-wifi-tenda-ac6-bang-tan-kep-chuan-ac-1200mbps-hang-phan-phoi-chinh-thuc-i372226241.html
Bộ phát wifi TPLink 2 râu 842N hình thức đẹp tốc độ 300Mbps,Không tìm thấy cửa hàng,0,Không có đánh giá,"₫89,000",4.0K sold,https://www.lazada.vn/products/bo-phat-wifi-tplink-2-rau-842n-hinh-thuc-dep-toc-do-300mbps-i575740555.html
Bộ Phát Wifi Băng Tần Kép TP-Link 3320 4 Râu AC600 ( Hàng Cũ ),BPK STORE,Không có đánh giá,825 đánh giá,"₫145,000",2.4K sold,https://www.lazada.vn/products/bo-phat-wifi-bang-tan-kep-tp-link-3320-4-rau-ac600-hang-cu-i580024192.html
Cục phát router wifi băng tần kép chuẩn AC 1200Mbps A720R TOTOLINK,TOTOLINK,4.8,982 đánh giá,"₫429,000",4.7K sold,https://www.lazada.vn/products/cuc-phat-router-wifi-bang-tan-kep-chuan-ac-1200mbps-a720r-totolink-i828618315.html
Bộ Phát Wifi6 ZTE E2603 chuẩn Ax1800Mbps -Có Mesh 2 băng tần,Không tìm thấy cửa hàng,0,Không có đánh giá,"₫243,000",109 sold,https://www.lazada.vn/products/bo-phat-wifi6-zte-e2603-chuan-ax1800mbps-co-mesh-2-bang-tan-i2506695661.html
Hệ thống WiFi Mesh TP-Link Deco E4 AC1200 Dành Cho Gia Đình - Hãng phân phối chính thức,Không tìm thấy cửa hàng,0,Không có đánh giá,"₫699,000",741 sold,https://www.lazada.vn/products/he-thong-wifi-mesh-tp-link-deco-e4-ac1200-danh-cho-gia-dinh-hang-phan-phoi-chinh-thuc-i286006065.html
"Bộ phát WIFI6 1600 Ax1800Mbps, wifi6 2 băng tần có mesh",Không tìm thấy cửa hàng,0,Không có đánh giá,"₫212,000",122 sold,https://www.lazada.vn/products/bo-phat-wifi6-1600-ax1800mbps-wifi6-2-bang-tan-co-mesh-i2393703662.html
[Wifi thế hệ mới] Bộ Phát Router Wifi TP-Link Archer AX23 Wifi 6 Chuẩn AX1800,TP-Link,Không có đánh giá,119 đánh giá,"₫1,099,000",440 sold,https://www.lazada.vn/products/wifi-the-he-moi-bo-phat-router-wifi-tp-link-archer-ax23-wifi-6-chuan-ax1800-i1568678053.html
Bộ phát router Wifi 6 TP-LINK WMA301 WMA302 AX3000 có Mesh,Không tìm thấy cửa hàng,0,Không có đánh giá,"₫299,000",35 sold,https://www.lazada.vn/products/bo-phat-router-wifi-6-tp-link-wma301-wma302-ax3000-co-mesh-i2677621220.html
Router Wifi 4G OLAX U80 ELITE Modem - USB Phiên Bản Mới Phát Wifi Cực Mạnh Từ Sim 4G Dễ Dàng Sử Dụng - BH 3 Tháng Lỗi Đổi Mới,Không tìm thấy cửa hàng,0,Không có đánh giá,"₫355,000",866 sold,https://www.lazada.vn/products/router-wifi-4g-olax-u80-elite-modem-usb-phien-ban-moi-phat-wifi-cuc-manh-tu-sim-4g-de-dang-su-dung-bh-3-thang-loi-doi-moi-i1237159313.html
Bộ Phát Wifi TP-Link Archer C6 Chuẩn AC 1200Mbps - Hãng phân phối chính thức,Không tìm thấy cửa hàng,0,Không có đánh giá,"₫619,000",281 sold,https://www.lazada.vn/products/bo-phat-wifi-tp-link-archer-c6-chuan-ac-1200mbps-hang-phan-phoi-chinh-thuc-i404176906.html
"[10.10 Voucher 10%] Router 4G, lắp sim vào là dùng được ngay không cài đặt, Có thể cắm dây mạng LAN 4G/3G WiFi 4G, Router Wifi 4G không dây",LAMJAD-Cửa hàng điện tử,4.8,29 đánh giá,"₫530,000",111 sold,https://www.lazada.vn/products/1010-voucher-10-router-4g-lap-sim-vao-la-dung-duoc-ngay-khong-cai-dat-co-the-cam-day-mang-lan-4g3g-wifi-4g-router-wifi-4g-khong-day-i2289133243.html
"Bộ phát wifi TPLINK băng tần kép sóng xuyên tường 6300 chuẩn AC 1200 Mbps , router wifi tplink Modem wifi sóng xuyên tường băng tần kép, bộ phát wifi 5ghz, cuc phat wifi, bo phat wifi tplink, bộ phát wifi tplink- Hàng Thanh Ly 90%",TTSTore1,4.4,10 đánh giá,"₫179,000",52 sold,https://www.lazada.vn/products/bo-phat-wifi-tplink-bang-tan-kep-song-xuyen-tuong-6300-chuan-ac-1200-mbps-router-wifi-tplink-modem-wifi-song-xuyen-tuong-bang-tan-kep-bo-phat-wifi-5ghz-cuc-phat-wifi-bo-phat-wifi-tplink-bo-phat-wifi-tplink-hang-thanh-ly-90-i1477401422.html
